PT	AU	BA	BE	GP	AF	BF	CA	TI	SO	SE	BS	LA	DT	CT	CY	CL	SP	HO	DE	ID	AB	C1	RP	EM	RI	OI	FU	FX	CR	NR	TC	Z9	U1	U2	PU	PI	PA	SN	EI	BN	J9	JI	PD	PY	VL	IS	PN	SU	SI	MA	BP	EP	AR	DI	D2	EA	EY	PG	WC	SC	GA	UT	PM	OA	HC	HP	DA
S	Zhu, L		Xiang, S		Zhu, Lin			Improved Probability Algorithm Based on Low Energy Bluetooth Technology	PROCEEDINGS OF THE 2014 INTERNATIONAL CONFERENCE ON COMPUTER SCIENCE AND ELECTRONIC TECHNOLOGY	ACSR-Advances in Comptuer Science Research		English	Proceedings Paper	International Conference on Computer Science and Electronic Technology (ICCSET)	DEC 27-28, 2014	ShenZhen, PEOPLES R CHINA			Location Fingerprints; Bluetooth Low Energy; Distribution; Probabilistic Algorithms		With the use of low energy Bluetooth technology, it aims to examine the positioning accuracy and performance of location fingerprint algorithm and thus to make improvements. To locate by means of Bluetooth 4.0 (i.e. low-energy Bluetooth tech) is energy saving, costing less, deploying easily etc. So here we choose Bluetooth 4.0 as the positioning way to make in-depth studies. Besides, we choose location fingerprint positioning method for the reason that the method has many merits like easy implementation, low costs, quick creation of correct mathematical model. It can be effectively and quickly put into practical applications.	Guiyang Univ, Guiyang 550005, Peoples R China	Zhu, L (reprint author), Guiyang Univ, Guiyang 550005, Peoples R China.	byronalder@hotmail.com					Li Feng, 2014, APPL COMPUTER SYSTEM, V07, P152; Liu Wen, 2014, J HUAZHONG U SCI TEC, V03, P19; theory Lie, 2014, J TRANSDUCER TECHNOL, V03, P388; Wang Saiwei, 2009, WLAN INDOOR POSITION; Wang Yanke, 2014, WIRELESS INTERNET TE, V04, P121; Wang Zhongmin, 2014, J XIAN U POSTS ELECO, V01, P17; Yan Feng, 2014, SCI TECHNOLOGY INFOR, V08	7	0	0	0	1	ATLANTIS PRESS	PARIS	29 AVENUE LAVMIERE, PARIS, 75019, FRANCE	2352-538X		978-94-62520-47-9	ACSR ADV COMPUT			2015	6						155	157						3	Computer Science, Theory & Methods	Computer Science	BD1ZU	WOS:000358534900033					2019-03-21	
S	Liu, YH; Bachmann, C; Wang, XY; Zhang, Y; Ba, A; Busze, B; Ding, M; Harpe, P; van Schaik, GJ; Selimis, G; Giesen, H; Gloudemans, J; Sbai, A; Huang, L; Kato, H; Dolmans, G; Philips, K; de Groot, H			IEEE	Liu, Yao-Hong; Bachmann, Christian; Wang, Xiaoyan; Zhang, Yan; Ba, Ao; Busze, Benjamin; Ding, Ming; Harpe, Pieter; van Schaik, Gert-Jan; Selimis, Georgios; Giesen, Hans; Gloudemans, Jordy; Sbai, Adnane; Huang, Li; Kato, Hiromu; Dolmans, Guido; Philips, Kathleen; de Groot, Harmke			A 3.7mW-RX 4.4mW-TX Fully Integrated Bluetooth Low-Energy/IEEE802.15.4/Proprietary SoC with an ADPLL-Based Fast Frequency Offset Compensation in 40nm CMOS	2015 IEEE INTERNATIONAL SOLID-STATE CIRCUITS CONFERENCE DIGEST OF TECHNICAL PAPERS (ISSCC)	IEEE International Solid State Circuits Conference		English	Proceedings Paper	62nd IEEE International Solid-State Circuits Conference (ISSCC)	FEB 22-26, 2015	San Francisco, CA	Inst Elect & Elect Engineers					[Liu, Yao-Hong; Bachmann, Christian; Wang, Xiaoyan; Zhang, Yan; Ba, Ao; Busze, Benjamin; Ding, Ming; van Schaik, Gert-Jan; Selimis, Georgios; Giesen, Hans; Gloudemans, Jordy; Sbai, Adnane; Huang, Li; Dolmans, Guido; Philips, Kathleen; de Groot, Harmke] IMEC, Holst Ctr, Eindhoven, Netherlands; [Harpe, Pieter] Eindhoven Univ Technol, NL-5600 MB Eindhoven, Netherlands; [Kato, Hiromu] Renesas Elect, Kawasaki, Kanagawa, Japan	Liu, YH (reprint author), IMEC, Holst Ctr, Eindhoven, Netherlands.			Liu, Yao-Hong/0000-0002-3256-6741			Bachmann C, 2014, ISSCC DIG TECH PAP I, V57, P186, DOI 10.1109/ISSCC.2014.6757393; Chillara V., 2014, ISSCC, P454; Liu Y., 2013, IEEE ISSCC, P446; Pengg F., 2013, IEEE RAD FREQ INT CI, P71; Wang A., 2012, ISSCC, P300	5	20	20	0	1	IEEE	NEW YORK	345 E 47TH ST, NEW YORK, NY 10017 USA	0193-6530		978-1-4799-6224-2	ISSCC DIG TECH PAP I			2015	58						236	U330						3	Engineering, Electrical & Electronic	Engineering	BC7WN	WOS:000355252700096					2019-03-21	
S	Prummel, J; Papamichail, M; Ancis, M; Willms, J; Todi, R; Aartsen, W; Kruiskamp, W; Haanstra, J; Opbroek, E; Rievers, S; Seesink, P; Woering, H; Smit, C			IEEE	Prummel, Jan; Papamichail, Michail; Ancis, Michele; Willms, John; Todi, Rahul; Aartsen, William; Kruiskamp, Wim; Haanstra, Johan; Opbroek, Enno; Rievers, Soren; Seesink, Peter; Woering, Harrie; Smit, Chris			A 10mW Bluetooth Low-Energy Transceiver with On-Chip Matching	2015 IEEE INTERNATIONAL SOLID-STATE CIRCUITS CONFERENCE DIGEST OF TECHNICAL PAPERS (ISSCC)	IEEE International Solid State Circuits Conference		English	Proceedings Paper	62nd IEEE International Solid-State Circuits Conference (ISSCC)	FEB 22-26, 2015	San Francisco, CA	Inst Elect & Elect Engineers					[Prummel, Jan; Papamichail, Michail; Ancis, Michele; Willms, John; Todi, Rahul; Aartsen, William; Kruiskamp, Wim; Haanstra, Johan; Opbroek, Enno; Rievers, Soren; Seesink, Peter; Woering, Harrie; Smit, Chris] Dialog Semicond, Shertogenbosch, Netherlands	Prummel, J (reprint author), Dialog Semicond, Shertogenbosch, Netherlands.						Harpe PJA, 2011, IEEE J SOLID-ST CIRC, V46, P1585, DOI 10.1109/JSSC.2011.2143870; Klumperink EAM, 2004, IEEE J SOLID-ST CIRC, V39, P1231, DOI 10.1109/JSSC.2004.831797; Liu Y., 2013, IEEE ISSCC, P446; Nordic Semiconductor, 2012, NRF51822 PROD SPEC 1; Pengg F., 2013, IEEE RAD FREQ INT CI, P71; Texas Instruments, 2012, CC2540F128 CC2540F25	6	11	11	0	1	IEEE	NEW YORK	345 E 47TH ST, NEW YORK, NY 10017 USA	0193-6530		978-1-4799-6224-2	ISSCC DIG TECH PAP I			2015	58						238	U333						3	Engineering, Electrical & Electronic	Engineering	BC7WN	WOS:000355252700097					2019-03-21	
S	Selvakumar, A; Zargham, M; Liscidini, A			IEEE	Selvakumar, Anith; Zargham, Meysam; Liscidini, Antonio			A 600 mu W Bluetooth Low-Energy Front-End Receiver in 0.13 mu m CMOS Technology	2015 IEEE INTERNATIONAL SOLID-STATE CIRCUITS CONFERENCE DIGEST OF TECHNICAL PAPERS (ISSCC)	IEEE International Solid State Circuits Conference		English	Proceedings Paper	62nd IEEE International Solid-State Circuits Conference (ISSCC)	FEB 22-26, 2015	San Francisco, CA	Inst Elect & Elect Engineers					[Selvakumar, Anith; Zargham, Meysam; Liscidini, Antonio] Univ Toronto, Toronto, ON, Canada	Selvakumar, A (reprint author), Qualcomm, San Diego, CA 92121 USA.						Greenberg J., 2012, IEEE INT SOL STAT CI, P162; Lin Z., 2013, ISSCC FEB, P448; Masuch J, 2013, IEEE T MICROW THEORY, V61, P1660, DOI 10.1109/TMTT.2013.2247621; Tedeschi M, 2010, IEEE J SOLID-ST CIRC, V45, P1710, DOI 10.1109/JSSC.2010.2053861; Wang KP, 2014, ISSCC DIG TECH PAP I, V57, P372, DOI 10.1109/ISSCC.2014.6757475; Zhang F., 2013, ISSCC, P456	6	0	0	0	1	IEEE	NEW YORK	345 E 47TH ST, NEW YORK, NY 10017 USA	0193-6530		978-1-4799-6224-2	ISSCC DIG TECH PAP I			2015	58						244	U342						3	Engineering, Electrical & Electronic	Engineering	BC7WN	WOS:000355252700100					2019-03-21	
S	Lee, M; Park, K; Lee, W; No, KS; Park, I; Kim, S		Tromberg, BJ; Yodh, AG; SevickMuraca, EM; Alfano, RR		Lee, Minseok; Park, Kyoungsu; Lee, Wonki; No, Keun-Sik; Park, Ilyong; Kim, Sehwan			A MD-NIR interactance based wireless sensing platform for the measurement of a subcutaneous fat thickness: a pilot study	OPTICAL TOMOGRAPHY AND SPECTROSCOPY OF TISSUE XI	Proceedings of SPIE		English	Proceedings Paper	Conference on Optical Tomography and Spectroscopy of Tissue XI	FEB 09-11, 2015	San Francisco, CA	SPIE		near infrared interactance; sensors; fat; spatially resolved; multi-distance		This paper presents a safe, affordable, and noninvasive approach to estimate subcutaneous fat thickness by using a multi-distance near infrared (MD-NIR) interactance-based wireless sensing platform. In order to perform the simultaneous measurements at several distances, two light sources with different wavelengths are located at one end of a line followed by seven photo diodes. Bluetooth Low Energy are adopted as their primary communication protocol as a wireless communication. The measured data from the MD-NIR interactance sensors are wirelessly transmitted to a smartphone or a tablet for analysis. The feasibility of the approach and wireless platform is demonstrated using the ex vivo pig fat layer phantoms.	[Lee, Minseok; Park, Kyoungsu; Lee, Wonki; Kim, Sehwan] Dankook Univ, Dept Med Laser, Cheonan Si, Chungnam, South Korea; [Park, Ilyong; Kim, Sehwan] Dankook Univ, Coll Med, Dept Biomed Engn, Cheonan Si, Chungnam, South Korea; [Lee, Minseok; Park, Kyoungsu; Park, Ilyong; Kim, Sehwan] Dankook Univ, Beckman Laser Inst Korea, Cheonan Si, Chungnam, South Korea; [No, Keun-Sik] Univ Calif Irvine, Beckman Laser Inst, Irvine, CA 92617 USA	Lee, M (reprint author), Dankook Univ, Dept Med Laser, 119 Dandae Ro, Cheonan Si, Chungnam, South Korea.	paul.kim@dankook.ac.kr					Jacques SL, 2013, PHYS MED BIOL, V58, pR37, DOI 10.1088/0031-9155/58/11/R37; MATCHER SJ, 1995, P SOC PHOTO-OPT INS, V2389, P486; Tuchin V. V., 2000, SPIE TUTORIAL TEXTS, VTT 38; VANVEEN RLP, 2005, J BIOMED OPT, V10, P40046; YODH A, 1995, PHYS TODAY, V48, P34, DOI 10.1063/1.881445; Zeskind J. E., 2002, SPATIALLY RESOLVED L	6	0	0	0	3	SPIE-INT SOC OPTICAL ENGINEERING	BELLINGHAM	1000 20TH ST, PO BOX 10, BELLINGHAM, WA 98227-0010 USA	0277-786X		978-1-62841-409-7	PROC SPIE			2015	9319								931902	10.1117/12.2077887				5	Optics; Radiology, Nuclear Medicine & Medical Imaging; Spectroscopy	Optics; Radiology, Nuclear Medicine & Medical Imaging; Spectroscopy	BC5XT	WOS:000353631300001					2019-03-21	
J	Want, R; Schilit, BN; Jenson, S				Want, Roy; Schilit, Bill N.; Jenson, Scott			Enabling the Internet of Things	COMPUTER			English	Article						Bluetooth; Internet of things; Cloud computing; Tagging; Protocols; Web services; Energy efficiency; Bluetooth low energy; Internet of Things (IoT); networking; Physical Web; Web of Things; proximate discovery; electronic tagging			[Want, Roy; Schilit, Bill N.; Jenson, Scott] Google, Mountain View, CA 94043 USA	Want, R (reprint author), Google, Mountain View, CA 94043 USA.	roywant@gmail.com; schilit@gmail.com; scott@jenson.org					Anderson C., 2004, WIRED, V12; Heydon R., 2013, BLUETOOTH LOW ENERGY; Jain S, 2006, MOBILE NETW APPL, V11, P327, DOI 10.1007/s11036-006-5186-9; Kato H, 2007, IEEE PERVAS COMPUT, V6, P76, DOI 10.1109/MPRV.2007.80; Kindberg T., 2002, ACM J MOBILE NETWORK, V7; Satyanarayanan M, 2001, IEEE PERS COMMUN, V8, P10, DOI 10.1109/98.943998; Satyanarayanan M, 2009, IEEE PERVAS COMPUT, V8, P14, DOI 10.1109/MPRV.2009.82; Schilit BN, 2004, COMPUTER, V37, P56, DOI 10.1109/MC.2004.241; Want R, 2004, SCI AM, V290, P56, DOI 10.1038/scientificamerican0104-56; WANT R, 1999, P CHI 1999, V99, P370; Weiser M., 1991, SCI AM, V265	11	123	123	9	84	IEEE COMPUTER SOC	LOS ALAMITOS	10662 LOS VAQUEROS CIRCLE, PO BOX 3014, LOS ALAMITOS, CA 90720-1314 USA	0018-9162	1558-0814		COMPUTER	Computer	JAN	2015	48	1					28	35		10.1109/MC.2015.12				8	Computer Science, Hardware & Architecture; Computer Science, Software Engineering	Computer Science	CB4TW	WOS:000349622100015			Y	N	2019-03-21	
J	Lin, JR; Talty, T; Tonguz, OK				Lin, Jiun-Ren; Talty, Timothy; Tonguz, Ozan K.			On the Potential of Bluetooth Low Energy Technology for Vehicular Applications	IEEE COMMUNICATIONS MAGAZINE			English	Article							WIRELESS SENSOR NETWORKS	With the increasing number of sensors in modern vehicles, using an intra-vehicular wireless sensor network (IVWSN) is a possible solution for the automotive industry for addressing the potential issues that arise from additional wiring harness. Such a solution could help car manufacturers develop vehicles that have better fuel economy and performance, in addition to supporting new applications. However, which wireless technology should be used for maximizing the benefits of IVWSNs is still an open issue. In this article we propose to use a new wireless technology known as Bluetooth Low Energy (BLE) and outline a new architecture for IVWSN. Based on a comprehensive study that encompasses an example application, it is shown that BLE is an excellent option that can be used in IVWSNs for certain applications mainly due to its good performance and low-power, low-complexity, and low-cost attributes.	[Lin, Jiun-Ren; Tonguz, Ozan K.] Carnegie Mellon Univ, Dept Elect & Comp Engn, Pittsburgh, PA 15213 USA; [Talty, Timothy] Gen Motors LLC, Detroit, MI USA	Lin, JR (reprint author), Carnegie Mellon Univ, Dept Elect & Comp Engn, Pittsburgh, PA 15213 USA.						Ahmed M., 2007, P IEEE GLOB WORKSH N; [Anonymous], 2010, BLUETOOTH CORE VERSI; [Anonymous], 2013, BLUETOOTH CORE VERSI; Bas CU, 2013, IEEE T VEH TECHNOL, V62, P14, DOI 10.1109/TVT.2012.2215969; ELBATT T., 2006, P 3 INT WORKSH VEH A, P1, DOI DOI 10.1145/1161064.1161066; Lee J.S., 2007, P 33 ANN C IEEE IND, V1-3, P46; Lin J.-R., 2013, P IEEE GLOB COMM C D; Moghimi AR, 2009, IEEE T VEH TECHNOL, V58, P5299, DOI 10.1109/TVT.2009.2022759; Ryan M., 2013, P 7 USENIX C OFF TEC, V13, P4; Texas Instruments, 2010, AN092 TEX INSTR; Texas Instruments, 2013, CC2541 RF TRANSC DAT; Texas Instruments, CC2540 MIN KIT; Tonguz O.K., 2006, AD HOC WIRELESS NETW; Tsai HM, 2007, IEEE ICC, P3965, DOI 10.1109/ICC.2007.653; Tsai HM, 2007, IEEE WIREL COMMUN, V14, P67, DOI 10.1109/MWC.2007.4407229; ZigBee Alliance, 2007, ZIGBEE 2007 SPEC	16	29	30	0	22	IEEE-INST ELECTRICAL ELECTRONICS ENGINEERS INC	PISCATAWAY	445 HOES LANE, PISCATAWAY, NJ 08855-4141 USA	0163-6804	1558-1896		IEEE COMMUN MAG	IEEE Commun. Mag.	JAN	2015	53	1					267	275		10.1109/MCOM.2015.7010544				9	Engineering, Electrical & Electronic; Telecommunications	Engineering; Telecommunications	AZ4UY	WOS:000348219800035					2019-03-21	
S	Hany, MA; Abdel-Hamid, AT		Ismail, L		Hany, Mahmoud A.; Abdel-Hamid, Amr T.			ZEIN: An Indoor Zigbee Planning Tool	2015 11TH INTERNATIONAL CONFERENCE ON INNOVATIONS IN INFORMATION TECHNOLOGY (IIT)	IEEE International Conference on Innovations in Information Technology		English	Proceedings Paper	11th International Conference on Innovations in Information Technology (IIT)	NOV 01-03, 2015	Dubai, U ARAB EMIRATES	IEEE, IEEE Comp Soc, UAE Univ, Coll Informat Technol, Univ New S Wales, IBM, Gen Elect Software, UAE Univ, Australian Defense Force Acad, Springer				With the advent of new wireless technologies, such as ZigBee and Bluetooth Low Energy (BLE), smart home systems have become more popular and affordable. One of the main challenges of wireless networks, especially mesh networks, is optimizing these networks such that they provide strong and reliable communication channels with minimum resource consumption. In this paper, we design and build a wireless network planning tool which achieves successful node-to-node communication through proper node placement. This tool aids ZigBee network designers in optimizing their wireless networks. Zein tool is made to simulate the zigbee mesh network in any structure and determine the exact locations of additional nodes to be placed to insure proper operation of the mesh network. The structure can vary from different designs and applications in terms of closed spaces example: Smart homes, companies and large industries or even university campuses. The algorithm of this tool is based upon Tarjans algorithm and connecting the nodes with each other and the server node by finding the nodes wall intersections that will insure reaching the average of all the initially placed nodes one step at a time till eventually creating Zigbee node hopes and achieving both way communications.	[Hany, Mahmoud A.; Abdel-Hamid, Amr T.] German Univ Cairo, Fac Informat Engn & Technol, Cairo, Egypt	Hany, MA (reprint author), German Univ Cairo, Fac Informat Engn & Technol, Cairo, Egypt.	mahmoud.hany@student.guc.edu.eg; amr.talaat@guc.edu.eg					Gloria B., 1999, MICR C 1999 29 EUR, V2; Tarjan R., 1972, SIAM Journal on Computing, V1, P146, DOI 10.1137/0201010; Torres RP, 1999, IEEE ANTENNAS PROPAG, V41, P11, DOI 10.1109/74.789733	3	0	0	0	1	IEEE	NEW YORK	345 E 47TH ST, NEW YORK, NY 10017 USA	1819-9127		978-1-4673-8511-4	IEEE INT CONF INNOV			2015							250	255						6	Computer Science, Information Systems; Computer Science, Interdisciplinary Applications; Engineering, Electrical & Electronic	Computer Science; Engineering	BI5BE	WOS:000412207900045					2019-03-21	
B	Zhao, YX; Yin, F; Gunnarsson, F; Amirijoo, M; Ozkan, E; Gustafsson, F			IEEE	Zhao, Yuxin; Yin, Feng; Gunnarsson, Fredrik; Amirijoo, Mehdi; Oezkan, Emre; Gustafsson, Fredrik			Particle Filtering for Positioning Based on Proximity Reports	2015 18TH INTERNATIONAL CONFERENCE ON INFORMATION FUSION (FUSION)			English	Proceedings Paper	18th International Conference on Information Fusion (Fusion)	JUL 06-09, 2015	Washington, DC					The commercial interest in proximity services is increasing. Application examples include location-based information and advertisements, logistics, social networking, file sharing, etc. In this paper, we consider positioning of devices based on time series proximity reports from a mobile device to a network node. This corresponds to nonlinear measurements with respect to the device position in relation to the network nodes. Therefore, particle filtering is applicable for positioning. Positioning performance is evaluated in a typical office area with Bluetooth-low-energy beacons deployed for proximity detection and report. Accuracy is concluded to vary spatially over the office floor, and in relation to the beacon deployment density.	[Zhao, Yuxin; Yin, Feng; Gunnarsson, Fredrik; Amirijoo, Mehdi] Ericsson Res, Linkoping, Sweden; [Oezkan, Emre; Gustafsson, Fredrik] Linkoping Univ, ISY, Linkoping, Sweden	Zhao, YX (reprint author), Ericsson Res, Linkoping, Sweden.	yuxin.zhao@ericsson.com; feng.yin@ericsson.com; fredrik.gunnarsson@ericsson.com; mehdi.amirijoo@ericsson.com; emre@isy.liu.se; fredrik@isy.liu.se	Ozkan, Emre/B-4864-2019	Ozkan, Emre/0000-0002-0380-2928			Gustafsson F, 2002, IEEE T SIGNAL PROCES, V50, P425, DOI 10.1109/78.978396; Gustafsson F, 2012, STAT SENSOR FUSION; Gustafsson F, 2010, IEEE AERO EL SYS MAG, V25, P53, DOI 10.1109/MAES.2010.5546308; Karlsson R., 2005, 13 EUR SIGN PROC C E; Sarkka S., 2013, BAYESIAN FILTERING S; Yin F., 2015, P INT C INF FU UNPUB	6	5	5	0	1	IEEE	NEW YORK	345 E 47TH ST, NEW YORK, NY 10017 USA			978-0-9824-4386-6				2015							1046	1052						7	Computer Science, Artificial Intelligence; Computer Science, Interdisciplinary Applications; Engineering, Electrical & Electronic	Computer Science; Engineering	BG5KW	WOS:000389523300137					2019-03-21	
B	Yin, F; Zhao, YX; Gunnarsson, F			IEEE	Yin, Feng; Zhao, Yuxin; Gunnarsson, Fredrik			Proximity Report Triggering Threshold Optimization for Network-Based Indoor Positioning	2015 18TH INTERNATIONAL CONFERENCE ON INFORMATION FUSION (FUSION)			English	Proceedings Paper	18th International Conference on Information Fusion (Fusion)	JUL 06-09, 2015	Washington, DC					Driven by the promising beaconing techniques, this paper presents a general received-signal-strength (RSS) threshold optimization procedure for proximity reports to support network-based indoor positioning. The desired RSS threshold is found through optimizing a metric function (for instance the localization root-mean-square-error) in terms of both the deployment information and the RSS modeling in consideration of an evaluation area. The resulting RSS threshold provides a trade-off between triggering many but less informative proximity reports with a low threshold, and triggering few but very informative proximity reports with a high threshold, and thus enables enhanced performance for some low-cost and low-complex proximity based positioning algorithms. The proposed framework is also validated with real RSS measurements collected in an office area with deployed bluetooth low-energy (BLE) beacons.	[Yin, Feng; Zhao, Yuxin; Gunnarsson, Fredrik] Ericsson Res, Linkoping, Sweden	Yin, F (reprint author), Ericsson Res, Linkoping, Sweden.	feng.yin@ericsson.com; yuxin.zhao@ericsson.com; fredrik.gunnarsson@ericsson.com					Abbas T., 2014, P COST IC1004 10 MAN; Bergman N., 1999, THESIS; Di Taranto R, 2014, IEEE SIGNAL PROC MAG, V31, P102, DOI 10.1109/MSP.2014.2332611; Giorgetti G, 2008, ACM S MODEL ANAL SIM, P220; Goldsmith A., 2006, WIRELESS COMMUNICATI; GUDMUNDSON M, 1991, ELECTRON LETT, V27, P2145, DOI 10.1049/el:19911328; Gustafsson F, 2005, IEEE SIGNAL PROC MAG, V22, P41, DOI 10.1109/MSP.2005.1458284; Gustafsson F, 2012, STAT SENSOR FUSION; Koorapaty H., 2004, P VTC C, V5, P2686; Rasmussen CE, 2010, J MACH LEARN RES, V11, P3011; Rasmussen CE, 2005, ADAPT COMPUT MACH LE, P1; Zhao Y., 2015, P INT C INF FUS WASH	12	5	5	0	0	IEEE	NEW YORK	345 E 47TH ST, NEW YORK, NY 10017 USA			978-0-9824-4386-6				2015							1061	1069						9	Computer Science, Artificial Intelligence; Computer Science, Interdisciplinary Applications; Engineering, Electrical & Electronic	Computer Science; Engineering	BG5KW	WOS:000389523300139					2019-03-21	
S	Corna, A; Fontana, L; Nacci, AA; Sciuto, D			IEEE	Corna, A.; Fontana, L.; Nacci, A. A.; Sciuto, D.			Occupancy Detection via iBeacon on Android Devices for Smart Building Management	2015 DESIGN, AUTOMATION & TEST IN EUROPE CONFERENCE & EXHIBITION (DATE)	Design Automation and Test in Europe Conference and Exhibition		English	Proceedings Paper	Conference on Design Automation Test in Europe (DATE)	MAR 09-13, 2015	Alpexpo Congress Center, Grenoble, FRANCE	European Design & Automation Association, Elect Design Automation Consortium, IEEE Council on Elec Design Automation, European Elect Chips & Syst design Initiative, ACM Special Interest Grp on Design Automation, Russian Acad of Sciences, IEEE Comp Soc test technology tech Council (tttC), IEEE Solid-State Circuits Soc (SSCS), International Federation for Information Processing (IFIP), Ville De Grenoble, LETI, ST, MINALOGIC, Agence DEtudes et de Promotion de lIsere, Rhone Alpes, Grenoble Alpes, CMP, Systematic Paris Region Systems & ICT, Cluster SCC, JEITA, Synopsys, Mentor Graphics, Cadence, MathWorks, EUROTRAINING	Alpexpo Congress Center	smart buildings; indoor location; iBeacon; energy efficiency		Building heating, ventilation, and air conditioning (HVAC) systems are considered to be the main target for energy reduction due to their significant contribution to commercial buildings' energy consumption. Knowing a building's occupancy plays a crucial role in implementing demand-response HVAC. In this paper we propose a new solution based on the iBeacon technology. This solution is different from the previous ones because it leverages on the Bluetooth Low Energy standard, which provides lower power consumption. Moreover, the iBeacon protocol can be used both on iOs systems and Android ones, making this new approach portable. Differently from our previous work based on iOS devices, in this paper we focus on an Android based solution with the aim of increasing the accuracy of the location and the energy efficiency of the entire system. We increased the accuracy by 10% and the energy efficiency by 15%.	[Corna, A.; Fontana, L.; Nacci, A. A.; Sciuto, D.] Politecn Milan, Milan, Italy	Corna, A (reprint author), Politecn Milan, Milan, Italy.	andrea.corna@mail.polimi.it; lorenzo2.fontana@mail.polimi.it; alessandro.nacci@polimi.it; donatella.sciuto@polimi.it					Anastasi G, 2003, DISTR COMP SYST WORK; [Anonymous], 2012, TECHNICAL REPORT; Balaji B., 2013, P 11 ACM C EMB NETW, P17; Bolliger P, 2008, TECHNICAL REPORT; Bolliger  P., 2008, P 1 ACM INT WORKSH M, P55, DOI DOI 10.1145/1410012.1410025; Conte G., 2014, 1 ACM INT C EMB SYST; Enterprises L, MAK YOUR WI FI HI FI; HAHNEL D, 2004, ROBOTICS AUTOMATION, P1015; Jiang Y., 2012, P 2012 ACM C UB COMP, P441, DOI DOI 10.1145/2370216.2370282; Laura Auria R.A.M, 2007, TECHNICAL REPORT; Lee JS, 2007, IEEE IND ELEC, P46, DOI 10.1109/IECON.2007.4460126; Liu H, 2007, TECHNICAL REPORT; Melfi R., 2011, GREEN COMP C WORKSH, P1, DOI DOI 10.1109/IGCC.2011.6008560; Nacci A. A., 2014, 12 IEEE INT C EMB UB; Nacci A. A., ADAPTIVE FLEXIBLE SM; Networks R., MAK IBEACON ANDR 1; NGUYEN NT, 2013, WIR COMM NETW C WCNC, P2119; Ni LM, 2004, WIREL NETW, V10, P701, DOI 10.1023/B:WINE.0000044029.06344.dd; Otsason V, 2005, LECT NOTES COMPUT SC, V3660, P141; Pei L., 2010, ADV SAT SPAC COMM SP, P151; WANT R, 1992, ACM T INFORM SYST, V10, P91, DOI 10.1145/128756.128759; Ward Andy, 1997, PERS COMMUN, V4, P42, DOI DOI 10.1109/98.626982	22	18	18	0	2	IEEE	NEW YORK	345 E 47TH ST, NEW YORK, NY 10017 USA	1530-1591		978-3-9815-3704-8	DES AUT TEST EUROPE			2015							629	632						4	Computer Science, Hardware & Architecture; Computer Science, Software Engineering; Engineering, Electrical & Electronic	Computer Science; Engineering	BF1GB	WOS:000380393200117					2019-03-21	
