PT	AU	BA	BE	GP	AF	BF	CA	TI	SO	SE	BS	LA	DT	CT	CY	CL	SP	HO	DE	ID	AB	C1	RP	EM	RI	OI	FU	FX	CR	NR	TC	Z9	U1	U2	PU	PI	PA	SN	EI	BN	J9	JI	PD	PY	VL	IS	PN	SU	SI	MA	BP	EP	AR	DI	D2	EA	EY	PG	WC	SC	GA	UT	PM	OA	HC	HP	DA
B	Zhang, Y; Liu, YH; Bachman, C; Dolmans, G; de Groot, H			IEEE	Zhang, Yan; Liu, Yao-Hong; Bachman, Christian; Dolmans, Guido; de Groot, Harmke			A Fast Convergence Two-stage AGC for a Bluetooth Low Energy Radio with 84dB Tuning Range	2014 IEEE 25TH ANNUAL INTERNATIONAL SYMPOSIUM ON PERSONAL, INDOOR, AND MOBILE RADIO COMMUNICATION (PIMRC)			English	Proceedings Paper	25th IEEE Annual International Symposium on Personal, Indoor, and Mobile Radio Communication (PIMRC)	SEP 02-05, 2014	Washington, DC	IEEE		AGC; fast convergence; Bluetooth low energy	FEEDFORWARD	In recent years, Bluetooth low energy (BLE) has become a very popular standard for short range wireless communications. The simplified link control layer and concise packet structure make it very appealing to low power applications with medium data rate requirement. However, the very short preamble of a BLE packet is also present as a new design challenge. In such a burst data communication scenario, a short preamble means that only a very short time interval is allowed to adjust the gain of the receiver analog front end to condition the input signal strength to a proper level for decent demodulation in the digital baseband. Aiming at this problem, a fast convergence two-stage automatic gain control (AGC) loop is proposed in this paper. The algorithm is explained in details, and the performance is verified via simulation.	[Zhang, Yan; Liu, Yao-Hong; Bachman, Christian; Dolmans, Guido; de Groot, Harmke] Imec Nl, Holst Ctr, High Tech Campus 31, NL-5656 AE Eindhoven, Netherlands	Zhang, Y (reprint author), Imec Nl, Holst Ctr, High Tech Campus 31, NL-5656 AE Eindhoven, Netherlands.	yan.zhang@imec-nl.nl		Liu, Yao-Hong/0000-0002-3256-6741	MSP - Multi Sensor Platform for Smart Building Management FP7-ICT Collaborative Project [611887]	This work is done as part of the project MSP - Multi Sensor Platform for Smart Building Management (FP7-ICT-2013-10 Collaborative Project, No. 611887).	Perez JPA, 2010, IEEE T IND ELECTRON, V57, P2851, DOI 10.1109/TIE.2009.2036021; Bachmann C., 2014, SOL STAT CIRC C ISSC, P186; FUJII M, 1995, ELECTRON LETT, V31, P1029, DOI 10.1049/el:19950736; Hioe W., 2003, VLSI CIRC 2003 2003, P127; Li Chengwei, 2006, Conference Proceedings. Annual International Conference of the IEEE Engineering in Medicine and Biology Society (IEEE Cat. No. 06CH37748); Liu YM, 2013, ADV EDUC RES, V7, P446; Xia Gaofeng, 2012, SIGN PROC ICSP 2012, V2, P1373	7	1	1	0	2	IEEE	NEW YORK	345 E 47TH ST, NEW YORK, NY 10017 USA			978-1-4799-4912-0				2014							1921	1925						5	Engineering, Electrical & Electronic; Telecommunications	Engineering; Telecommunications	BG8UW	WOS:000392729300365					2019-03-21	
B	Lee, T; Han, K; Lee, M; Park, S; Yang, CYH			IEEE	Lee, Taeyoung; Han, Kwanghun; Lee, Myounghwan; Park, Seonghee; Yang, Chil-Youl Hacky			Multi-Connectivity Strategy for Agile Service Delivery with Low Power Discovery	2014 IEEE 25TH ANNUAL INTERNATIONAL SYMPOSIUM ON PERSONAL, INDOOR, AND MOBILE RADIO COMMUNICATION (PIMRC)			English	Proceedings Paper	25th IEEE Annual International Symposium on Personal, Indoor, and Mobile Radio Communication (PIMRC)	SEP 02-05, 2014	Washington, DC	IEEE				To deliver services using wireless connectivity on mobile devices, service discovery with low power and service execution with fast connection are the essential factors. However, no single connectivity technology satisfies fast service execution with low power discovery because agile service delivery fundamentally requires consuming high power. Therefore, we propose a synergetic multi-connectivity strategy utilizing Bluetooth Low Energy (BLE) discovery and Wi-Fi Peer to Peer (P2P) fast connection for agile service delivery. Furthermore, we develop an adaptive BLE discovery algorithm to enhance the discovery performance. Finally, the experiment of the multi-connectivity scheme and the theoretical simulation of the discovery algorithm show that the proposed approach excellently provides the fast service delivery with low power discovery.	[Lee, Taeyoung; Han, Kwanghun; Lee, Myounghwan; Park, Seonghee; Yang, Chil-Youl Hacky] Samsung Elect, DMC R&D Ctr, Commun Solut Lab, Suwon, South Korea	Lee, T (reprint author), Samsung Elect, DMC R&D Ctr, Commun Solut Lab, Suwon, South Korea.	ty82.lee@samsung.com; kh0703.han@samsung.com; mh1031.lee@samsung.com; seong.park@samsung.com; hacky710@samsung.com					Bluetooth SIG, 2010, BLUET COR SPEC VERS; Kamath S., AN092; Liu J, 2012, IEEE GLOB COMM CONF, P1538, DOI 10.1109/GLOCOM.2012.6503332	3	0	0	0	0	IEEE	NEW YORK	345 E 47TH ST, NEW YORK, NY 10017 USA			978-1-4799-4912-0				2014							2071	2075						5	Engineering, Electrical & Electronic; Telecommunications	Engineering; Telecommunications	BG8UW	WOS:000392729300393					2019-03-21	
B	Kajioka, S; Mori, T; Uchiya, T; Takumi, I; Matsuo, H			IEEE	Kajioka, Shinsuke; Mori, Tomoya; Uchiya, Takahiro; Takumi, Ichi; Matsuo, Hiroshi			Experiment of Indoor Position Presumption Based on RSSI of Bluetooth LE Beacon	2014 IEEE 3RD GLOBAL CONFERENCE ON CONSUMER ELECTRONICS (GCCE)			English	Proceedings Paper	3rd IEEE Global Conference on Consumer Electronics (GCCE)	OCT 07-10, 2014	Tokyo, JAPAN	IEEE				Real-time indoor location estimation needs multiple signals from different sources. To ensure accuracy of estimation, adopting Bluetooth Low Energy (LE) beacon devices as signal sources is a reasonable solution. We have installed a number of Bluetooth Low Energy (LE) beacon devices in and around a room and observed beacons by portable devices with RSSI to achieve fundamental knowledge of beacons and feasibility of location estimation. By applying an estimation method, we have achieved over 95% of correct estimation rate and complete separation that a device is in a room or not.	[Kajioka, Shinsuke; Mori, Tomoya; Uchiya, Takahiro; Takumi, Ichi; Matsuo, Hiroshi] Nagoya Inst Technol, Showa Ku, Gokiso Cho, Nagoya, Aichi 4668555, Japan	Kajioka, S (reprint author), Nagoya Inst Technol, Showa Ku, Gokiso Cho, Nagoya, Aichi 4668555, Japan.	kajioka@nitech.ac.jp; t.mori.319@nitech.jp; t-uchiya@nitech.ac.jp; takumi@nitech.ac.jp; matsuo@nitech.ac.jp					Bahl P., 2000, Proceedings IEEE INFOCOM 2000. Conference on Computer Communications. Nineteenth Annual Joint Conference of the IEEE Computer and Communications Societies (Cat. No.00CH37064), P775, DOI 10.1109/INFCOM.2000.832252; Bluetooth SIG, 2010, SPEC BLUET SYST V4 0; Ito S, 2005, Third IEEE International Conference on Pervasive Computing and Communications, Workshops, P273, DOI 10.1109/PERCOMW.2005.19; Kuriakose J., 2014, ADV INTELLIGENT SYST, V264, P599; Liu H, 2007, IEEE T SYST MAN CY C, V37, P1067, DOI 10.1109/TSMCC.2007.905750; Oksar I., 2014, P INT C SYST SIGN IM, P251; Xie Z., 2013, ACTIVE MEDIA TECHNOL, V8210, P46; Zhou S, 2006, IEEE T CONSUM ELECTR, V52, P555, DOI 10.1109/TCE.2006.1649679; Zhu J., 2012, P IEEE COMM SOC C SE, P290	9	36	36	0	3	IEEE	NEW YORK	345 E 47TH ST, NEW YORK, NY 10017 USA							2014							337	339						3	Engineering, Electrical & Electronic	Engineering	BF6CK	WOS:000382964400121					2019-03-21	
B	Bassbouss, L; Guclu, G; Steglich, S			IEEE	Bassbouss, Louay; Gueclue, Goerkem; Steglich, Stephan			Towards a Remote Launch Mechanism of TV Companion Applications Using iBeacon	2014 IEEE 3RD GLOBAL CONFERENCE ON CONSUMER ELECTRONICS (GCCE)			English	Proceedings Paper	3rd IEEE Global Conference on Consumer Electronics (GCCE)	OCT 07-10, 2014	Tokyo, JAPAN	IEEE		Second Screen; Multiscreen; Application Launch; iBeacon; Bluetooth Low Energy		TV sets and companion devices (Smartphones, Tablets, etc.) have outgrown their original purpose and are now playing together an important role to offer the best user experience on multiple screens. However, the collaboration between TV and companion applications faces challenges that go beyond traditional single screen applications. These range from discovery, wake-up and pairing of devices, to application launch, communication, synchronization and adaptation to target device and screen size. In this position paper, we will limit ourselves to the Remote Launch aspect and introduce an idea for a new mechanism for launching companion applications using iBeacon technology.	[Bassbouss, Louay; Gueclue, Goerkem; Steglich, Stephan] Fraunhofer FOKUS, Kaiserin Augusta Allee 31, D-10589 Berlin, Germany	Bassbouss, L (reprint author), Fraunhofer FOKUS, Kaiserin Augusta Allee 31, D-10589 Berlin, Germany.	louay.bassbouss@fokus.fraunhofer.de; goerkem.gueclue@fokus.fraunhofer.de; stephan.steglich@fokus.fraunhofer.de					Netflix, 2014, DISCOVERY LAUNCH PRO; UPnP Forum, 2008, UPNP DEV ARCH 1 1	2	2	2	0	1	IEEE	NEW YORK	345 E 47TH ST, NEW YORK, NY 10017 USA							2014							538	539						2	Engineering, Electrical & Electronic	Engineering	BF6CK	WOS:000382964400190					2019-03-21	
S	Varsamou, M; Antonakopoulos, T			IEEE	Varsamou, Maria; Antonakopoulos, Theodore			A Bluetooth Smart Analyzer in iBeacon Networks	2014 IEEE Fourth International Conference on Consumer Electronics Berlin (ICCE-Berlin)	IEEE International Conference on Consumer Electronics-Berlin		English	Proceedings Paper	4th IEEE International Conference on Consumer Electronics Berlin (ICCE-Berlin)	SEP 07-10, 2014	Berlin, GERMANY	IEEE, VDE ITG, IFA Consumer Elect Ltd, Univ Cordoba, technicolor, AiQ SmartClothing, htw, IEEE Consumer Elect Soc				Bluetooth Low Energy (BLE) is a newly emerged technology targeting low-power, low-cost wireless communications within medium or short range. BLE has extended the already wide acceptance of Bluetooth and is an ideal choice for a variety of sensor-based products, as well as ubiquitous mobile devices. Recently, it has been proposed that indoor positioning can be achieved when scattering BLE sensor devices, called iBeacons, in various locations of a particular venue. In this work, we present an Android-based application for analyzing iBeacon networks and determining the best signal map. We also demonstrate the application of the presented analyzer for measuring the radiation pattern of iBeacon devices.	[Varsamou, Maria; Antonakopoulos, Theodore] Univ Patras, Dept Elect & Comp Engn, Patras 26504, Greece	Varsamou, M (reprint author), Univ Patras, Dept Elect & Comp Engn, Patras 26504, Greece.	mtvars@upatras.gr; antonako@upatras.gr					[Anonymous], 2013, TECH REP; Cavallini A., IBEACONS BIBLE 1 0; Decuir J, 2014, IEEE CONSUM ELECTR M, V3, P25, DOI 10.1109/MCE.2013.2297617; Heydon R., 2012, BLUETOOTH LOW ENERGY; Ilyas M., 2005, HDB SENSOR NETWORKS; Slijepcevic S. M. S., 2003, 2 INT C INF PROC SEN, P593; ZigBee Alliance, 2012, TECH REP	7	7	7	0	0	IEEE	NEW YORK	345 E 47TH ST, NEW YORK, NY 10017 USA	2166-6814		978-1-4799-6165-8	IEEE I C CONS ELECT			2014							288	292						5	Engineering, Electrical & Electronic	Engineering	BG8UI	WOS:000392716400080					2019-03-21	
B	Barge, WC; Chou, TS; Lin, YT; Ozan, E			IEEE	Barge, William C.; Chou, Te-Shun; Lin, Yuetong; Ozan, Erol			A Model of Packet Loss in the Bluetooth Low Energy Component of a Wearable Body Area Network Caused by Interference from a Residential Microwave Oven	2014 IEEE Healthcare Innovation Conference (HIC)			English	Proceedings Paper	2014 IEEE Healthcare Innovation Conference (HIC)	OCT 08-10, 2014	Seattle, WA					Cardiovascular diseases are the leading cause of death in the United States. Advances in wireless technology have made possible the remote monitoring of a patient's heart sensors as part of a body area network. Some of these networks use a Bluetooth Low Energy (BLE) component to transmit the signal between the bio sensors and a smart phone. This study investigates the impact that stray wireless transmissions from residential microwave ovens have on the BLE component of the body area network. The results of this study may lead to improvements and widespread use of body area network medical systems, which may lead to better monitoring, more data, and fewer fatalities due to misdiagnosed heart conditions.	[Barge, William C.] Trine Univ, Angola, IN 46703 USA; [Barge, William C.] Indiana State Univ, Technol Management Program, Terre Haute, IN 47809 USA; [Chou, Te-Shun; Ozan, Erol] East Carolina Univ, Greenville, NC 27858 USA; [Lin, Yuetong] Indiana State Univ, Terre Haute, IN 47809 USA	Barge, WC (reprint author), Trine Univ, Angola, IN 46703 USA.	bargeb@trine.edu; chout@ecu.edu; yuetong.lin@indstate.edu; ozang@ecu.edu					Alesanco A., 2010, IEEE T INF TECHNOL B, V14, P9; [Anonymous], 2005, HOME APPLIANCES CHAR; [Anonymous], 2014, HEART DIS FACTS; Bluetooth SIG Inc, 2012, BLUET TECHN CREAT HU; Chen M., 2011, MOBILE NETW APPL, V16, P23; Chowdhury K. R., 2009, COMM 2009 ICC 09 IEE; Coplu T., 2011, CONS COMM NETW C CCN; Huo H., 2010, J CHINA U POSTS TELE, V17, P10; Johny B., 2014, POTENTIALS IEEE, V33, P5; Latre B, 2011, WIREL NETW, V17, P1, DOI 10.1007/s11276-010-0252-4; Rondeau T. W., 2004, CONSUMER ELECT IEEE, V50, P8; Sikora A., 2005, IMTC 2005 INSTR MEAS; Taher T. M., 2008, WCNC 2008 IEEE WIR C; Zakas N. C., 2013, COMMUN ACM, V56, P7; Zhang M., 2013, DAC 13	15	1	1	0	2	IEEE	NEW YORK	345 E 47TH ST, NEW YORK, NY 10017 USA							2014							87	90						4	Engineering, Biomedical; Engineering, Electrical & Electronic	Engineering	BF3MU	WOS:000380557700021					2019-03-21	
B	Zhang, T; Lu, J; Hu, F; Hao, Q			IEEE	Zhang, Ting; Lu, Jiang; Hu, Fei; Hao, Qi			Bluetooth Low Energy for Wearable Sensor-based Healthcare Systems	2014 IEEE HEALTHCARE INNOVATION CONFERENCE (HIC)			English	Proceedings Paper	2014 IEEE Healthcare Innovation Conference (HIC)	OCT 08-10, 2014	Seattle, WA			Healthcare systems; Wearable technologies; Wireless communication; Bluetooth low energy; Biomedicine	ECG	Wearable sensor-based healthcare systems have drawn a lot of attention from the scientific community and the industry during the past several years. As the healthcare cost is increasing and the population is aging, unobtrusive, low cost and accurate healthcare systems will potentially transform the future of healthcare. They are convenient to use, and can be utilized directly from home or community. These systems have various functionalities, such as bio-signal monitoring, signal analysis and biofeedback. They are consist of subsystems including sensors, data aggregators, data processing units, connected by wired or wireless communication modules. The developing goal of the systems includes to increase the performance accuracy, to make the system smaller, to prolong the battery life and to lower the product cost. Bluetooth low energy (BLE), comparing to traditional wired or other wireless communication modules, is beneficial for these design goals. Devices with bluetooth low energy are attracting more scientists and engineers in research and are changing individuals' lives with products such as wearable sport bends, smart toothbrushes, and intelligent watches. In this paper, we provide an overview of the state-of-the-art Bluetooth low energy technology. Further, we list and analyze the most popular commercial products and the available developing tools.	[Zhang, Ting; Lu, Jiang; Hu, Fei; Hao, Qi] Univ Alabama, Dept Elect & Comp Engn, Tuscaloosa, AL 35487 USA	Zhang, T (reprint author), Univ Alabama, Dept Elect & Comp Engn, Tuscaloosa, AL 35487 USA.	fei@eng.ua.edu; qh@eng.ua.edu					Ali M, 2011, EUR MICROW CONF, P1265; Dinh A, 2011, CAN CON EL COMP EN, P665, DOI 10.1109/CCECE.2011.6030536; Dixon AMR, 2012, IEEE T BIOMED CIRC S, V6, P156, DOI 10.1109/TBCAS.2012.2193668; Gomez C, 2012, SENSORS-BASEL, V12, P11734, DOI 10.3390/s120911734; Ito K., 1994, uS Patent, Patent No. [5,355,882, 5355882]; Mamaghanian H, 2011, IEEE T BIO-MED ENG, V58, P2456, DOI 10.1109/TBME.2011.2156795; Mazhelis Oleksiy, 2012, Internet of Thing, Smart Spaces, and Next Generation Networking. 12th International Conference (NEW2AN 2012) and 5th Conference (ruSMART 2012). Proceedings, P1, DOI 10.1007/978-3-642-32686-8_1; Mena LJ, 2013, COMPUT MATH METHOD M, DOI 10.1155/2013/598196; Morikawa K, 2013, IEEE ICCE, P204, DOI 10.1109/ICCE.2013.6486859; Pahlavan K., 2011, PRINCIPLES WIRELESS; Pantelopoulos A, 2010, IEEE T SYST MAN CY C, V40, P1, DOI 10.1109/TSMCC.2009.2032660; Patel S, 2012, J NEUROENG REHABIL, V9, DOI 10.1186/1743-0003-9-21; Sammon E., 2014, INT J THERAPY REHABI, V21, pS4; Wang HG, 2010, IEEE WIREL COMMUN, V17, P12, DOI 10.1109/MWC.2010.5416345; Wiegerinck JI, 2009, GAIT POSTURE, V29, P514, DOI 10.1016/j.gaitpost.2008.12.001; Wong ACW, 2013, IEEE J SOLID-ST CIRC, V48, P186, DOI 10.1109/JSSC.2012.2221215; Xu X., 2014, FRONTIER FUTURE DEV, P979; Zhang T, 2013, IEEE ENG MED BIO, P6337, DOI 10.1109/EMBC.2013.6611003; Zhang T, 2012, IEEE ENG MED BIO, P4353, DOI 10.1109/EMBC.2012.6346930	19	14	14	0	1	IEEE	NEW YORK	345 E 47TH ST, NEW YORK, NY 10017 USA							2014							251	254						4	Engineering, Biomedical; Engineering, Electrical & Electronic	Engineering	BF3MU	WOS:000380557700060					2019-03-21	
B	Lee, CT; Yang, CH; Chang, CM; Kao, CY; Tseng, HM; Hsu, HP; Chou, PH			IEEE	Lee, Cheng-Ting; Yang, Cheng-Hsun; Chang, Chun-Min; Kao, Chung-Yi; Tseng, Hua-Min; Hsu, Henpai; Chou, Pai H.			A Smart Energy System with Distributed Access Control	2014 IEEE INTERNATIONAL CONFERENCE (ITHINGS) - 2014 IEEE INTERNATIONAL CONFERENCE ON GREEN COMPUTING AND COMMUNICATIONS (GREENCOM) - 2014 IEEE INTERNATIONAL CONFERENCE ON CYBER-PHYSICAL-SOCIAL COMPUTING (CPS)			English	Proceedings Paper	IEEE International Conference on Internet of Things ( iThings) / IEEE International Conference on Green Computing and Communications (GreenCom) / IEEE International Conference on Cyber-Physical-Social Computing (CPS)	SEP 01-03, 2014	Taipei, TAIWAN	IEEE, IEEE Internet Things, Bur Foreign TRADE, Minist Sci Tech, Intel, IEEE Comp Soc, Intel NTU, IEEE Comp Soc, Dept Informat & Tourism				This paper presents a new smart energy (SE) system with distributed access control. Many other SE systems to date support remote control and automation but not access control, making them applicable to homes but not offices or other public settings. Even if they implement access control, virtually all existing SE systems suffer from central point of failure. To address these problems, we propose a new SE system that supports not only access control but also distributed access from multiple devices without relying on centralized control. In addition to access-control list, we also take advantage of the proximity tag feature supported by the Bluetooth Low Energy (BLE) protocol without requiring users to take out their identifying BLE devices from their pockets as one would have to do with RFID tags. Experimental results show that our SE system to offer the security features required for public deployment with minimal power, latency, and cost overhead.	[Lee, Cheng-Ting; Yang, Cheng-Hsun; Chang, Chun-Min; Kao, Chung-Yi; Tseng, Hua-Min; Hsu, Henpai; Chou, Pai H.] Natl Tsing Hua Univ, Dept Comp Sci, Hsinchu 30013, Taiwan; [Chou, Pai H.] Univ Calif Irvine, Dept Comp Sci, Irvine, CA 92717 USA	Lee, CT (reprint author), Natl Tsing Hua Univ, Dept Comp Sci, Hsinchu 30013, Taiwan.	sunkist0704@hotmail.com; assassin784533@gmail.com; chun.m.chang@gmail.com; backman.only@gmail.com; thm822@gmail.com; dreamfliper@gmail.com; pai.chou@gmail.com					Artem Dementyev, 2013, P 2013 IEEE INT WIR, P1, DOI DOI 10.1109/IEEE-IWS.2013.6616827; Dou N., 2009, P INT FOR COMP SCI T, V2, P29; Gautham K., 2013, INT J ENG TECHNOLOGY, V5, P1527; Han DM, 2010, IEEE T CONSUM ELECTR, V56, P1417, DOI 10.1109/TCE.2010.5606278; Kim J. E., 2012, P 8 INT C INT ENV IE, P206; Lin K.-J., 2013, P IEEE INT C CYB PHY, P1175, DOI DOI 10.1109/GREENC0M-ITHINGS-CPSCOM.2013.204; Paradells J., 2010, COMMUNICATIONS MAGAZ, V48, P92, DOI DOI 10.1109/MCOM.2010.5473869; Ryan M., 2013, P USENIX; Sandhu RS, 1996, COMPUTER, V29, P38, DOI 10.1109/2.485845; TechCity Technology Co. Ltd., 2013, E2 LIVE; Texas Instruments, 2013, CC2541 2 4GHZ BLUET; WANG Z, 2013, P 2013 IEEE 9 INT C, P294, DOI DOI 10.1109/MSN.2013.24	12	0	0	0	0	IEEE	NEW YORK	345 E 47TH ST, NEW YORK, NY 10017 USA			978-1-4799-5967-9				2014							53	60		10.1109/iThings.2014.17				8	Computer Science, Theory & Methods; Engineering, Electrical & Electronic	Computer Science; Engineering	BF3JG	WOS:000380548400008					2019-03-21	
B	Wang, AP; Huang, YT; Lee, CT; Hsu, HP; Chou, PH			IEEE	Wang, Anping; Huang, Yu-Ting; Lee, Cheng-Ting; Hsu, Hen-Pai; Chou, Pai H.			EcoBT: Miniature, Versatile Mote Platform Based on Bluetooth Low Energy Technology	2014 IEEE International Conference (iThings) - 2014 IEEE International Conference on Green Computing and Communications (GreenCom) - 2014 IEEE International Conference on Cyber-Physical-Social Computing (CPS)			English	Proceedings Paper	IEEE International Conference on Internet of Things ( iThings) / IEEE International Conference on Green Computing and Communications (GreenCom) / IEEE International Conference on Cyber-Physical-Social Computing (CPS)	SEP 01-03, 2014	Taipei, TAIWAN	IEEE, IEEE Internet Things, Bur Foreign TRADE, Minist Sci Tech, Intel, IEEE Comp Soc, Intel NTU, IEEE Comp Soc, Dept Informat & Tourism				This paper describes EcoBT, one of the first wireless-sensing platforms to support Bluetooth Low Energy (BLE) as their primary communication protocol. EcoBT Super-node is a full-sized node with an on-board digital accelerometer with rich expansion ports, while EcoBT Mini is the miniature version merely 8x8 mm(2) in area. Included on both nodes are a digital accelerometer with programmable threshold detection for power saving, real-time clock, magnetic switches for contactless operation, and low-load DC-DC converters for low stand-by power when used in conjunction with a rechargeable Lithium-polymer battery. The use of BLE enables direct communication with a BLE-equipped smartphone, tablet, or laptop without the inconvenience of a dongle or an extra gateway device. These two platforms share the identical microcontroller unit (MCU), enabling code sharing between them with little or no porting effort. The versatility of these platforms is being demonstrated in several real-life applications ranging from temperature tracking in shipping containers and lighting control to and several wearable medical devices.	[Wang, Anping; Huang, Yu-Ting; Lee, Cheng-Ting; Hsu, Hen-Pai; Chou, Pai H.] Natl Tsing Hua Univ, Dept Comp Sci, Hsinchu 30013, Taiwan; [Chou, Pai H.] Univ Calif Irvine, Ctr Embedded Comp Syst, Irvine, CA USA	Wang, AP (reprint author), Natl Tsing Hua Univ, Dept Comp Sci, Hsinchu 30013, Taiwan.	csiewap@gmail.com; hyt.ting@gmail.com; phchou@uci.edu					Antenova Ltd, ANT RUFA A5839 RUF 2; Chen C.-Y., 2009, IEEE EMBEDDED SYSTEM, V1, P73; Chou P.H., 2013, P 2013 6 IEEE INT C; Gravem D., 2011, J MED DEVICES; Lee C.T., 2014, P IEEE INT C INT THI; MOLEX, SLIMSTACK 0 50MM PIT; Murata, 2012, MAGN SWITCH; STMicroelectronics, 2013, LIS331DLH MEMS MOT S; Texas Instruments, TPS62730 STEP CONV B; Texas Instruments, BQ51013 GEN 2 INT WI; Texas Instruments, 2012, 2 4 GHZ BLUET LOW EN; Walsin Technology Corporation, RFANT3216120A5T 2 4	12	1	1	0	1	IEEE	NEW YORK	345 E 47TH ST, NEW YORK, NY 10017 USA			978-1-4799-5967-9				2014							148	154		10.1109/iThings.2014.30				7	Computer Science, Theory & Methods; Engineering, Electrical & Electronic	Computer Science; Engineering	BF3JG	WOS:000380548400021					2019-03-21	
