PT	AU	BA	BE	GP	AF	BF	CA	TI	SO	SE	BS	LA	DT	CT	CY	CL	SP	HO	DE	ID	AB	C1	RP	EM	RI	OI	FU	FX	CR	NR	TC	Z9	U1	U2	PU	PI	PA	SN	EI	BN	J9	JI	PD	PY	VL	IS	PN	SU	SI	MA	BP	EP	AR	DI	D2	EA	EY	PG	WC	SC	GA	UT	PM	OA	HC	HP	DA
B	Bai, CF; Yang, J; Wu, JH		Hong, W; Zhu, X; Yang, G; Song, Z; Meng, F		Bai, Chunfeng; Yang, Jian; Wu, Jianhui			A Highly Linear Programmable Gain Amplifier with Level Shifter and Class AB Output Stage for Bluetooth Low Energy	2015 ASIA-PACIFIC MICROWAVE CONFERENCE (APMC), VOLS 1-3	Asia Pacific Microwave Conference-Proceedings		English	Proceedings Paper	Asia-Pacific Microwave Conference (APMC)	DEC 06-09, 2015	Nanjing, PEOPLES R CHINA	SE Univ, Nanjing Univ Sci & Technol, Chinese Inst Elect, IEEE Microwave Theory & Tech Soc, European Microwave Assoc, IEEE Antennas & Propagat Soc, Sci & Technol Antenna & Microwave Lab, State Key Lab Millimeter Waves, Jiangsu Inst Elect, IEEE AP MTT EMC Joint Nanjing Chapter, Journal Microwaves		highly linear PGA; level shifter; class AB output; BLE		A highly linear PGA with level shifter and class AB output stage for BLE receiver is reported in this paper. Both merits of degenerated PGA and operational amplifier based PGA are synthesized in proposed PGA. It is implemented in 0.18 mu m CMOS process and draws 290pA current from a supply of 1.8V when driving a capacitor load of 2p at the IF of 1MHz, while high SR up to 2.2 x 10(7) V/s is obtained. OIP3 of 40dBm is achieved under all gain modes due to the constant loop bandwidth. Proposed PGA has a gain range from 0dB to 14dB at the step of 2dB. The THD reaches 72.7dB at the frequency of 1MHz when proposed PGA outputs a 1.3Vpp differential voltage signal.	[Bai, Chunfeng; Yang, Jian; Wu, Jianhui] Southeast Univ, Natl ASIC Syst Engn Res Ctr, Nanjing, Jiangsu, Peoples R China	Bai, CF (reprint author), Southeast Univ, Natl ASIC Syst Engn Res Ctr, Nanjing, Jiangsu, Peoples R China.						Gupta S, 2012, SOLID STATE CIRCUITS, V47, P1141; Hogervorst R, 1994, SOLID STATE CIRCUITS, V29, P1505; Hsu C C, 2003, SOLID STATE CIRCUITS, V38, P1663; JEON O, 2006, SOLID STATE CIRCUITS, V41, P2291, DOI DOI 10.1109/JSSC.2006.881548; Liu Yao-Hong, 2015, IEEE INT SOL STAT CI; Rijns JJF, 1996, IEEE J SOLID-ST CIRC, V31, P1029, DOI 10.1109/4.508217	6	0	0	0	0	IEEE	NEW YORK	345 E 47TH ST, NEW YORK, NY 10017 USA			978-1-4799-8767-2	ASIA PACIF MICROWAVE			2015														3	Engineering, Electrical & Electronic; Telecommunications	Engineering; Telecommunications	BF5OB	WOS:000382378800022					2019-03-21	
B	Zhang, JJ; Lin, FJ; Wang, YZ; Diao, SX		Hong, W; Zhu, X; Yang, G; Song, Z; Meng, F		Zhang, Jiji; Lin, Fujiang; Wang, Yunzhen; Diao, Shengxi			Design of Low-Energy Transceivers in Nanoscale CMOS for Internet of Things (Invited)	2015 ASIA-PACIFIC MICROWAVE CONFERENCE (APMC), VOLS 1-3	Asia Pacific Microwave Conference-Proceedings		English	Proceedings Paper	Asia-Pacific Microwave Conference (APMC)	DEC 06-09, 2015	Nanjing, PEOPLES R CHINA	SE Univ, Nanjing Univ Sci & Technol, Chinese Inst Elect, IEEE Microwave Theory & Tech Soc, European Microwave Assoc, IEEE Antennas & Propagat Soc, Sci & Technol Antenna & Microwave Lab, State Key Lab Millimeter Waves, Jiangsu Inst Elect, IEEE AP MTT EMC Joint Nanjing Chapter, Journal Microwaves				This paper presents three different low-power CMOS transceivers (TRx) for ZigBee, RFID and BLE designed at USTC. These TRx are compatible with three different IEEE standards. Firstly a highly integrated low-power 2.4GHz TRx with a low-IF receiver for IEEE 802.15.4 WPAN is briefed. Next, the TRx for Bluetooth Low Energy BLE 4.0 in standard 130nm CMOS is presented. Then, a low power UHF RFID Reader transceiver based on self-jammer cancellation is introduced.	[Zhang, Jiji; Lin, Fujiang; Wang, Yunzhen; Diao, Shengxi] Univ Sci & Technol China, Micronanoelect Syst Integrat R&D Ctr MESIC, Hefei 230027, Peoples R China	Zhang, JJ (reprint author), Univ Sci & Technol China, Micronanoelect Syst Integrat R&D Ctr MESIC, Hefei 230027, Peoples R China.	linfj@ustc.edu.cn					Aparin V, 2005, IEEE T MICROW THEORY, V53, P571, DOI 10.1109/TMTT.2004.840635; Chen N., 2011, RAD FREQ INT TECHN R, P137; Chen SWM, 2006, IEEE J SOLID-ST CIRC, V41, P2669, DOI 10.1109/JSSC.2006.884231; Jia F., 2012, J SEMICONDUCTORS, V33; Kluge W, 2006, IEEE J SOLID-ST CIRC, V41, P2767, DOI 10.1109/JSSC.2006.884802; Kwon I, 2008, IEEE J SOLID-ST CIRC, V43, P729, DOI 10.1109/JSSC.2007.914302; Liu H., 2012, OPTIM METHOD SOFTW, V1, P1, DOI DOI 10.1128/GEN0MEA.00936-13; Lv W., 2014, J SEMICONDUCTORS, V35; Mirzaei A, 2010, IEEE T CIRCUITS-I, V57, P2353, DOI 10.1109/TCSI.2010.2043014; Prummel J., 2015, ISSCC, P238; Radio Management Committee of China, 2007, APPL REQ RFID BANDS, P205; Raja M. K., 2010, SOL STAT CIRC C A SS, P1; Wang CL, 2014, ANALOG INTEGR CIRC S, V80, P273, DOI 10.1007/s10470-014-0329-6; Wang Y., 0 2 5 GHZ LNA LINEAR	14	0	0	0	2	IEEE	NEW YORK	345 E 47TH ST, NEW YORK, NY 10017 USA			978-1-4799-8767-2	ASIA PACIF MICROWAVE			2015														3	Engineering, Electrical & Electronic; Telecommunications	Engineering; Telecommunications	BF5OB	WOS:000382378800015					2019-03-21	
S	Guo, ZL; Harris, IG; Tsaur, LF; Chen, XB			IEEE	Guo, Zonglin; Harris, Ian G.; Tsaur, Lih-Feng; Chen, Xianbo			An On-demand Scatternet Formation and Multi-hop Routing Protocol for BLE-based wireless Sensor Networks	2015 IEEE WIRELESS COMMUNICATIONS AND NETWORKING CONFERENCE (WCNC)	IEEE Wireless Communications and Networking Conference		English	Proceedings Paper	IEEE Wireless Communications and Networking Conference (WCNC)	MAR 09-12, 2015	New Orleans, LA	IEEE		Bluetooth Low Energy; BLE; MANET/WPAN; Scatternet; Mesh network		As new features are introduced into the Bluetooth core specification, the ability to use Bluetooth Low Energy (BLE) technology to construct a mobile ad-hoc network (MANET) becomes a reality. Key features included in Bluetooth Specification version 4.1 are the ability for a single node to be part of multiple piconets, and the ability for a node to act dual mode, as both a piconet master and slave. These features allow the possibility of multi-hop routing spanning multiple connected piconets. Although multi-hop routing is theoretically possible with version 4.1, no multi-hop routing algorithm has never been presented which exploits this possibility. In this paper we propose an approach to scatternet formation and multi-hop routing for networks using BLE version 4.1. We define procedures for device discovery, communication between piconets and forming multi-hop scatternet. Our approach has the following properties, 1) it can be used with existing Bluetooth hardware, 2) the protocol is fully distributed, so global connectivity information is not required for formation and routing, and 3) it supports ad-hoc network formation. We have implemented our approach using real Bluetooth SoCs including the Broadcom BCM434x chipset which is used in the iPhone 6. Our experiments demonstrate the routing delay and throughput using networks containing different numbers of nodes in order to demonstrate the impact of network size on performance. As the network size increases, our protocol does not incur a large delay and achieves better resource utilization.	[Guo, Zonglin; Harris, Ian G.] Univ Calif Irvine, Ctr Embedded Comp Syst, Irvine, CA 92697 USA; [Guo, Zonglin; Tsaur, Lih-Feng; Chen, Xianbo] Broadcom Corp, San Diego, CA USA	Guo, ZL (reprint author), Univ Calif Irvine, Ctr Embedded Comp Syst, Irvine, CA 92697 USA.	zongling@uci.edu					Aichele C., 2008, BETTER APPROACH MOBI; Basagni S., 2002, IEEE GLOBECOM; Bhagwat P., 1994, COMP COMM REV    OCT; Cuomo F., 2003, IEEE GLOBECOM; Garcia-Luna-Aceves J. J., 1996, ACM MOBILE NETOWORKS; Johnson D. B., 1996, MOBILE COMPUTING, P153, DOI DOI 10.1007/978-0-585-29603-6_5; Lee Sung-Ju, 2000, P IEEE INFOCOM 2000, P565; Lu I., 1999, IEEE J SELECTED AREA; Methfessel M., 2011, INT C MOB AD HOC SEN; PERKINS CE, AD HOC ON DEMAND DIS; Petrioli C, 2004, MOBILE NETW APPL, V9, P33, DOI 10.1023/A:1027317722864; Whitaker R. M., 2005, Ad Hoc Networks, V3, P403, DOI 10.1016/j.adhoc.2004.02.002; Zaruba G. V., 2001, IEEE INT C COMM, V1, P273	13	20	20	0	2	IEEE	NEW YORK	345 E 47TH ST, NEW YORK, NY 10017 USA	1525-3511		978-1-4799-8406-0	IEEE WCNC			2015							1590	1595						6	Computer Science, Theory & Methods; Engineering, Electrical & Electronic; Telecommunications	Computer Science; Engineering; Telecommunications	BF4GX	WOS:000380909600271					2019-03-21	
S	Torres, H; Gonzalez, R; Campillo, D; Ledesma, E		Jaffray, DA		Torres, Hector; Gonzalez, Rene; Campillo, Daniel; Ledesma, Eyglis			A mobile terminal to follow-up the evolution of chronic diseases	WORLD CONGRESS ON MEDICAL PHYSICS AND BIOMEDICAL ENGINEERING, 2015, VOLS 1 AND 2	IFMBE Proceedings		English	Proceedings Paper	World Congress on Medical Physics and Biomedical Engineering	JUN 07-12, 2015	Toronto, CANADA			Telemedicine; ECG processing; RTOS; portable device		This paper presents the firmware design of a low cost and consumption portable device intended to collect (Bluetooth) and transmit (GSM/GPRS) biological signals to a website. This solution forms part of an ambulatory monitoring system for patients with related heart diseases like arrhythmia, hypertension and diabetes, giving a more close interaction between patients and doctors. The hardware is based on the MSP430F5419A microcontroller, the CC2540 Bluetooth Low Energy (both from Texas Instruments), and the SIM908 GSM/GPRS/GPS modem from Simcom. The real time operating system FreeRTOS was used in the firmware. QRS complexes are detected and processed in the ECG wave signal; blood pressure and glucose level are processed as well. A robust communication protocol was implemented and an easy graphical user interface also. A total of 50 different samples were uploaded to the website using developed prototypes in a safety way. This is an interesting solution to have into account in this kind of systems due to its low cost.	[Torres, Hector; Gonzalez, Rene; Campillo, Daniel; Ledesma, Eyglis] Cent Inst Digital Res, Div Med Dev, Havana, Cuba	Torres, H (reprint author), Cent Inst Digital Res, 202th St,1704, Havana, Cuba.	hectortm@icid.cu					[Anonymous], 2011, 60601225 IEC; Barry R., 2009, USING FREERTOS REAL; Gonzalez R., 2003, P 25 ANN INT C IEEE, V1, P2610; Gonzalez RI, 2009, IFMBE PROC, V25, P188, DOI 10.1007/978-3-642-03904-1_53; Kaplan WA, 2006, GLOBALIZATION HEALTH, V2, DOI 10.1186/1744-8603-2-9; LIGTENBERG A, 1983, COMPUT BIOMED RES, V16, P273, DOI 10.1016/0010-4809(83)90027-7; Worringham C, 2011, DEV FEASIBILITY SMAR	7	0	0	0	2	SPRINGER INT PUBLISHING AG	CHAM	GEWERBESTRASSE 11, CHAM, CH-6330, SWITZERLAND	1680-0737		978-3-319-19387-8; 978-3-319-19386-1	IFMBE PROC			2015	51						1060	1063		10.1007/978-3-319-19387-8_258				4	Biophysics; Engineering, Biomedical	Biophysics; Engineering	BF5AQ	WOS:000381813000258					2019-03-21	
B	Wendt, T; Volk, F; Mackensen, E			IEEE	Wendt, Thomas; Volk, Franziska; Mackensen, Elke			A benchmark survey of Long Range (LoRa (TM)) Spread-Spectrum-Communication at 2.45 GHz for safety applications	2015 IEEE 16TH ANNUAL WIRELESS AND MICROWAVE TECHNOLOGY CONFERENCE (WAMICON)			English	Proceedings Paper	IEEE 16th Annual Wireless and Microwave Technology Conference (WAMICON 2015)	APR 13-15, 2015	Cocoa Beach, FL			BLE; wireless sensor; low power wireless; spread spectrum; LoRa (TM); safety performance; propagation characteristic; reliable communication; safe wireless network; modem; wireless robustness; data transmission reliability		The demand of wireless solutions in industrial applications increases since the early nineties. This trend is not only ongoing, it is further pushed by developments in the area of software stacks like the latest Bluetooth Low Energy Stack. It is also pushed by new chip-designs and powerful and highly integrated electronic hardware. The acceptance of wireless technologies as a possible solution for industrial applications, has overcome the entry barrier [1]. The first step to see wireless as standard for many industrial applications is almost accomplished. Nevertheless there is nearly none acceptance of wireless technology for Safety applications. One highly challenging and demanding requirement is still unsolved: The aspect safety and robustness. Those topics have been addressed in many cases but always in a similar manner. WirelessHART as an example addresses this topic with redundant so called multiple propagation paths and frequency hopping to handle with interferences and loss of network participants. So far the pure peer to peer link is rarely investigated and there are less safety solutions available. One product called LoRa T can be seen as one possible solution to address this lack of safety within wireless links. This paper focuses on the safety performance evaluation of a modem-chip-design. The use of diverse and redundant wireless technologies like LoRa can lead to an increase acceptance of wireless in safety applications. Many measurements in real industrial application have been carried out to be able to benchmark the new chip in terms of the safety aspects. The content of this research results can help to raise the level of confidence in wireless. In this paper, the term "safety" is used for data transmission reliability.	[Wendt, Thomas] Univ Appl Sci Offenburg, Dept Business Adm & Ind Engn, Gengenbach, Germany; [Volk, Franziska; Mackensen, Elke] Univ Appl Sci Offenburg, Dept Elect Engn & Informat Techn, Offenburg, Germany	Wendt, T (reprint author), Univ Appl Sci Offenburg, Dept Business Adm & Ind Engn, Gengenbach, Germany.	Thomas.Wendt@hs-offenburg.de; franziska.volk@hs-offenburg.de					[Anonymous], 6150812010 IEC; [Anonymous], 6060112005COR2006COR; EM Microelectronic, 2014, MOD LORA FULL INT CO; EM Microelectronic-Marin SA, 2014, EM9203 1VOLT 2MBPS 2; Mackensen E., 2006, ANAL SIMULATION ENTW; Mackensen E., 2012, 1 EL EN HARV C 2012, P1; Semtech Corporation, 2013, SEMT SX1272 DAT REF; Volk F., 2014, THESIS; Wendt T M, 2009, RF MEMS APPL, V1	9	0	0	0	1	IEEE	NEW YORK	345 E 47TH ST, NEW YORK, NY 10017 USA			978-1-4799-7521-1				2015														4	Engineering, Electrical & Electronic; Telecommunications	Engineering; Telecommunications	BF3QF	WOS:000380567600004					2019-03-21	
B	Koivisto, M; Nurminen, H; Ali-Loytty, S; Piche, R			IEEE	Koivisto, Mike; Nurminen, Henri; Ali-Loytty, Simo; Piche, Robert			Graph-Based Map Matching for Indoor Positioning	2015 10TH INTERNATIONAL CONFERENCE ON INFORMATION, COMMUNICATIONS AND SIGNAL PROCESSING (ICICS)			English	Proceedings Paper	10th International Conference on Information, Communications and Signal Processing (ICICS)	DEC 02-04, 2015	Singapore, SINGAPORE			indoor positioning; particle filter; motion model; map matching; graph		This article presents a probabilistic motion model that is based on an economical graph-based indoor map representation, such that the motion of the user is constrained according to the floor plan of a building. The floor plan is modeled as a combination of links and open space polygons that are connected by nodes. In the authors' earlier work the link transition probabilities in this graph are proportional to the total link lengths that are the total lengths of the subgraphs accessible by choosing the considered link option, and this article extends this model to include open space polygons as well. A particle filter using the extended motion model in which all particles are constrained according to the map structure is presented. Furthermore, wireless local area network and Bluetooth Low Energy positioning tests show that the proposed algorithm outperforms comparison methods especially if the measurement rate is low.	[Koivisto, Mike; Nurminen, Henri; Ali-Loytty, Simo; Piche, Robert] Tampere Univ Technol, Tampere, Finland	Koivisto, M (reprint author), Tampere Univ Technol, Tampere, Finland.	mike.koivisto@tut.fi; henri.nurminen@tut.fi; simo.ali-loytty@tut.fi; robert.piche@tut.fi	Piche, Robert/H-4859-2012	Piche, Robert/0000-0003-1158-6951			Doucet A, 2000, STAT COMPUT, V10, P197, DOI 10.1023/A:1008935410038; Driessen H., 2008, IET SEM TARG TRACK D, P41; Evennou F, 2005, IEEE WCNC, P2490; Faragher Ramsey, 2015, IEEE J SELECTED AREA; Ferris B., 2006, 2006 ROB SCI SYST C; Khan M. I., 2013, 2013 INT C IND POS I, P884; Koivisto M., 2015, THESIS; Liao L., 2003, 2003 IEEE RSJ INT C, P723; Nurminen H., 2013, 2013 INT C IND POS I, P137; Nurminen H., 2012, 2012 INT C IND POS I, P461; Nurminen H, 2014, INT C INDOOR POSIT, P646, DOI 10.1109/IPIN.2014.7275539; Piche R., 2014, 11 IEEE WORKSH POS N; Skiena S., 1998, ALGORITHM DESIGN MAN	13	0	0	0	1	IEEE	NEW YORK	345 E 47TH ST, NEW YORK, NY 10017 USA			978-1-4673-7218-3				2015														5	Engineering, Electrical & Electronic; Telecommunications	Engineering; Telecommunications	BF4WZ	WOS:000381754800170					2019-03-21	
S	Cho, K; Jung, C; Kim, J; Yoon, Y; Han, K		FernandezDelCarpio, GM		Cho, Keuchul; Jung, Changsu; Kim, Jinbae; Yoon, Yongtak; Han, Kijun			Modeling and Analysis of Performance based on Bluetooth Low Energy	2015 7TH IEEE LATIN-AMERICAN CONFERENCE ON COMMUNICATIONS (LATINCOM)	IEEE Latin American Conference on Communications		English	Proceedings Paper	7th IEEE Latin-American Conference on Communications (LATINCOM)	NOV 04-06, 2015	Arequipa, PERU	IEEE, Univ Catolica San Pablo, Facultad Ingn Computac, Escula Profes Ingn Elect Telecomunicaciones, Centro Investigac, Elect Telecomunicaciones, IEEE Commun Soc		Bluetooth; BLE; discovery; latency	NEIGHBOR DISCOVERY; NETWORKS	Bluetooth Low Energy (BLE) is one of the optimal candidate technology used in short range wireless communications. The features of BLE such as low-cost and low-power dominates it over other technologies such ZigBee, etc. The BLE 4.0 standard provides the in-depth analysis of the BLE architecture. But still many aspects regarding the discovery process of the BLE needs refinement. The performance evaluation of the classical Bluetooth analysis is widely studied, but it cannot apply to the BLE 4.0 standard. Several schemes have been proposed in this regard, but none of them provides the complete discovery process analysis. Therefore, in this paper we provide a complete, new, and an accurate discovery process of BLE standard. The intensive analytical and simulation study provide a basis for the modeling of the BLE discovery process. Moreover, the proposed analysis investigates discovery probability as well as expected discovery latency in a wireless sensor network based on BLE, which are then validated via extensive experiments. We also investigate different parameters which directly affect the performance of the BLE discovery process. The parameters settings are examined, and an optimal setting is also proposed for low-power consumption during the discovery process.	[Cho, Keuchul; Jung, Changsu; Kim, Jinbae; Yoon, Yongtak; Han, Kijun] Kyungpook Natl Univ, Sch Comp Sci & Engn, Daegu, South Korea	Han, K (reprint author), Kyungpook Natl Univ, Sch Comp Sci & Engn, Daegu, South Korea.	k5435n@netopia.knu.ac.kr; changsu@netopia.knu.ac.kr; jbkim@netopia.knu.ac.kr; ytyoon@netopia.knu.ac.kr; kjhan@knu.ac.kr					Basagni S., 2002, NETWORKING 2002 NETW, V2345, P1087; Drula C, 2007, IEEE J SEL AREA COMM, V25, P96, DOI 10.1109/JSAC.2007.070110; Duflot M., 2006, International Journal on Software Tools for Technology Transfer, V8, P621, DOI 10.1007/s10009-006-0014-x; Liu J., 2012, ENERGY ANAL NEIGHBOR; Liu J, 2012, IEEE GLOB COMM CONF, P1538, DOI 10.1109/GLOCOM.2012.6503332; Liu J, 2012, IEEE COMMUN LETT, V16, P1439, DOI 10.1109/LCOMM.2012.073112.120877; LIU JL, 2013, CHEMPLUSCHEM, V78, P1; Patel M, 2010, IEEE WIREL COMMUN, V17, P80, DOI 10.1109/MWC.2010.5416354; Scott D., 2005, MOB COMPUT COMMUN RE, V9, P41, DOI DOI 10.1145/1055959.1055965	9	0	0	0	0	IEEE	NEW YORK	345 E 47TH ST, NEW YORK, NY 10017 USA	2330-989X		978-1-4673-8451-3	IEEE LATAMER CONF			2015														6	Engineering, Electrical & Electronic; Telecommunications	Engineering; Telecommunications	BF4QC	WOS:000381560800005					2019-03-21	
S	Juhana, T; Irawan, AI			IEEE	Juhana, Tutun; Irawan, Arif Indra			Non-Intrusive Load Monitoring Using Bluetooth Low Energy	2015 9TH INTERNATIONAL CONFERENCE ON TELECOMMUNICATION SYSTEMS SERVICES AND APPLICATIONS (TSSA)	International Conference on Telecommunication Systems Services and Applications		English	Proceedings Paper	9th International Conference on Telecommunication Systems Services and Applications (TSSA)	NOV 25-26, 2015	Bandung, INDONESIA			Smart homes; Energy measurement; Bluetooth Low Energy; Nonintrusive appliance load monitoring (NIALM)		The energy consumption in residential has been increasing over the past years. Many researches about energy saving which uses information and communication technology have been presented to conserve electrical consumption. Providing residents with information on their energy consumption has become a feasible option to promote energy saving in residential sector. In this paper, a home energy monitoring system using Bluetooth Low Energy (BLE) and sensor non-invasive, is described. The authors designed a system based on BLE and non-invasive sensor so monitoring process of electrical parameter such as voltage RMS, current RMS, real power, apparent power and power factor is realized.	[Juhana, Tutun; Irawan, Arif Indra] Inst Teknol Bandung, Sch Elect & Informat Engn, Bandung, Indonesia	Juhana, T (reprint author), Inst Teknol Bandung, Sch Elect & Informat Engn, Bandung, Indonesia.	tutun@stei.ac.id; arif.indra.irawan@gmail.com					Alfares HK, 2002, INT J SYST SCI, V33, P23, DOI 10.1080/00207720110067421; Cho Y. S., 2014, SENSING COMMUNICATIO, P192; Decuir J., 2014, CONSUMER ELECT MAGAZ, V3, P12; FRANK R, 2014, WIRELESS ON DEMAND N, P104; HART GW, 1992, P IEEE, V80, P1870, DOI 10.1109/5.192069; Hashizume A., 2012, 2012 IEEE Workshops of International Conference on Advanced Information Networking and Applications (WAINA), P595, DOI 10.1109/WAINA.2012.187; Kumar S., 2014, 18 IEEE INT S CONS E, P1; Lin Z. M., 2014, 2014 INT C IEEE INT, P1, DOI DOI 10.1109/ICIPRM.2014.6880585; Rajagopal, 2014, HUM TECHN C R10 HTC, P127; Tejani D., 2011, IEEE INT C DIG EC TE, P241; Yu B, 2012, PROCEEDING OF THE IEEE INTERNATIONAL CONFERENCE ON INFORMATION AND AUTOMATION, P763, DOI 10.1109/ICInfA.2012.6246921	11	0	0	0	0	IEEE	NEW YORK	345 E 47TH ST, NEW YORK, NY 10017 USA	2372-7314		978-1-4673-8447-6; 978-1-4673-8446-9	INT C TELECOMMUN SYS			2015														4	Engineering, Electrical & Electronic; Telecommunications	Engineering; Telecommunications	BF4GH	WOS:000380877100037					2019-03-21	
B	Tsimbalo, E; Fafoutis, X; Piechocki, R			IEEE	Tsimbalo, Evgeny; Fafoutis, Xenofon; Piechocki, Robert			Fix It, Don't Bin It! - CRC Error Correction in Bluetooth Low Energy	2015 IEEE 2ND WORLD FORUM ON INTERNET OF THINGS (WF-IOT)			English	Proceedings Paper	2015 IEEE 2nd World Forum on Internet of Things (WF-IoT)	DEC 14-16, 2015	Milan, ITALY	IEEE, IEEE Commun Soc, IEEE Council Elect Design Automat, Reliabil Soc, IEEE Signal Proc Soc, IEEE Connecting Mobile World, IEEE Comp Soc, IEEE Consumer Elect Soc, Sensors Council, IEEE Soc Social Implicat Technol, Univ Milano, TIM, TOSHIBA, Assoc Italiana Informat & Calcolo Automat		CRC; error correction; Bluetooth Low Energy	CODES	In this paper, we introduce error correction to the Bluetooth Low Energy (BLE) standard by utilising data redundancy provided by the Cyclic Redundancy Check (CRC) code used to detect erroneous packets. We assume a scenario with an energy-constrained transmitter and a constraint-free infrastructure, which allows us to introduce additional signal processing at the receiving side while keeping the transmitter intact. A novel approach of applying iterative decoding techniques to the BLE CRC code is investigated in this work. By using these techniques and real BLE packets collected in an office environment, we show that by enabling CRC error correction, the sensitivity of the BLE receiver can be improved by up to 3 dB. At the same time, up to 60% of corrupted packets can be corrected, which directly translates to a significant reduction in the number of retransmissions and a noticeable energy saving.	[Tsimbalo, Evgeny; Fafoutis, Xenofon; Piechocki, Robert] Univ Bristol, Dept Elect & Elect Engn, Bristol BS8 1TH, Avon, England	Tsimbalo, E (reprint author), Univ Bristol, Dept Elect & Elect Engn, Bristol BS8 1TH, Avon, England.	e.tsimbalo@bristol.ac.uk; xenofon.fafoutis@bristol.ac.uk; r.j.piechocki@bristol.ac.uk					Babaie S, 2009, 2009 FIFTH INTERNATIONAL CONFERENCE ON SEMANTICS, KNOWLEDGE AND GRID (SKG 2009), P254, DOI 10.1109/SKG.2009.77; Barman S., 2011, 2011 49 ANN ALL C CO, V59, P253; Bluetooth SIG, 2010, SPEC BLUET SYST COV; Boyd Stephen, 2010, Foundations and Trends in Machine Learning, V3, P1, DOI 10.1561/2200000016; Feldman J, 2005, IEEE T INFORM THEORY, V51, P954, DOI 10.1109/TIT.2004.842696; Gallager R. G., 1963, LOW DENSITY PARITY C, P112; Kumar V, 2005, IEEE COMMUN LETT, V9, P729, DOI 10.1109/LCOMM.2005.08020; Liu XS, 2012, 2012 IEEE INFORMATION THEORY WORKSHOP (ITW), P367, DOI 10.1109/ITW.2012.6404695; Moon TK, 2005, ERROR CORRECTION CODING: MATHEMATICAL METHODS AND ALGORITHMS, P1, DOI 10.1002/0471739219; Newman N., 2014, J DIRECT DATA DIGITA, V15, P222, DOI DOI 10.1057/DDDMP.2014.7; PETERSON WW, 1961, P IRE, V49, P228, DOI 10.1109/JRPROC.1961.287814; Sankaranarayanan S, 2005, IEEE T INFORM THEORY, V51, P3347, DOI 10.1109/TIT.2005.853321; Tsimbalo E., 2015, 26 IEEE INT S PERS I; Woznowski P., 2015, P INT C COMM ICC WOR; Zhang GQ, 2013, IEEE COMMUN LETT, V17, P2152, DOI 10.1109/LCOMM.2013.101413.130826; Zhang XJ, 2013, IEEE INT SYMP INFO, P1501, DOI 10.1109/ISIT.2013.6620477	16	1	1	0	0	IEEE	NEW YORK	345 E 47TH ST, NEW YORK, NY 10017 USA			978-1-5090-0366-2				2015							286	290						5	Computer Science, Theory & Methods; Engineering, Electrical & Electronic	Computer Science; Engineering	BF3QC	WOS:000380567200051					2019-03-21	
