PT	AU	BA	BE	GP	AF	BF	CA	TI	SO	SE	BS	LA	DT	CT	CY	CL	SP	HO	DE	ID	AB	C1	RP	EM	RI	OI	FU	FX	CR	NR	TC	Z9	U1	U2	PU	PI	PA	SN	EI	BN	J9	JI	PD	PY	VL	IS	PN	SU	SI	MA	BP	EP	AR	DI	D2	EA	EY	PG	WC	SC	GA	UT	PM	OA	HC	HP	DA
B	Ko, D; Kwak, Y; Choi, D; Song, S		Ma, J; Fang, WC		Ko, Dasik; Kwak, Yunsik; Choi, Dojin; Song, Seokil			Design of Cold Chain Application Framework (CCAF) based on IOT and Cloud	2015 8TH INTERNATIONAL CONFERENCE ON U- AND E-SERVICE, SCIENCE AND TECHNOLOGY (UNESST)			English	Proceedings Paper	Inter* Conf* e-Ser* Sci* Tech*	NOV 25-28, 2015	Jeju Island, SOUTH KOREA	Brno Univ Tech, Fac Information Technol, gecad, GASS, INFOBRIGHT, Instituto Superior de Engenharia do Porto, SERSC, Center Excellence Information Assurance		smart cold chain; internet of things; cloud; data analysis		In this paper, we propose a smart cold chain application framework (SCCAF) based on Cloud and IOT (Internet of Things) techniques. The purpose of SCCAF is to provide PaaS (Platform as a Service) and IaaS (Infra as a Service) to users who want to develop and apply cold chain management systems with low cost and in short time. Also, SCCAF enables users to use any type of IOT devices such as RFID tags, WSN sensor nodes, BLE (Bluetooth Low Energy) sensor nodes and so on. We define common components by generalizing function of existing cold chain management systems, and design SCCAF based on Hadoop and Spark to store the large amount of data stream on salable storage and process stream data to detect events and assess risks in cold chain.	[Ko, Dasik] Mokwon Univ, Dept Elect Engn, Daejeon, South Korea; [Kwak, Yunsik; Choi, Dojin; Song, Seokil] Korea Transportat Natl Univ, Dept Comp Engn, Chungju, Chungbuk, South Korea	Ko, D (reprint author), Mokwon Univ, Dept Elect Engn, Daejeon, South Korea.	kds@mokwon.ac.kr; yskwak@ut.ac.kr; mycdj91@ut.ac.kr; sisong@ut.ac.kr					Aung M. M., 2012, P WORLD ACAD SCI ENG; FU W, 2008, 6 INT C MAN RES UK S; Jiang W., 2015, J FOOD SCI TECHNOLOG, V7, P573; Ruiz-Garcia Luis, 2010, Sustainable Radio Frequency Identification Solutions, P37; Wang Y., 2015, J SENSORS; Xu W, 2014, INT J MULTIMEDIA UBI, V9, P111	6	0	0	0	3	IEEE	NEW YORK	345 E 47TH ST, NEW YORK, NY 10017 USA			978-1-4673-9852-7				2015							11	13		10.1109/UNESST.2015.8				3	Computer Science, Information Systems; Computer Science, Interdisciplinary Applications	Computer Science	BF1HJ	WOS:000380397200003					2019-03-21	
S	Murali, S; Rincon, F; Atienza, D		Murray, A		Murali, Srinivasan; Rincon, Francisco; Atienza, David			A Wearable Device For Physical and Emotional Health Monitoring	2015 COMPUTING IN CARDIOLOGY CONFERENCE (CINC)	Computing in Cardiology Series		English	Proceedings Paper	2015 Comp in Cardiol Conference (CinC)	SEP 06-09, 2015	Comp in Cardiol 2015, nice, FRANCE		Comp in Cardiol 2015			Personal health monitoring systems are emerging as promising solutions to develop ultra-small, portable devices that can continuously monitor and process several vital body parameters. In this work, we present a wearable device for physical and emotional health monitoring. The device obtains user's key physiological signals: ECG, respiration, Impedance Cardiogram (ICG), blood pressure and skin conductance and derives the user's emotion states as well. We have developed embedded algorithms that process the bio-signals in real-time to detect any abnormalities (cardiac arrhythmias and morphology changes) in the ECG and to detect key parameters (such as the Pre- Ejection Period and fluid status level) from the ICG. We present a novel method to detect continuous beat-by-beat blood pressure from the ECG and ICG signals, as well as a real-time embedded emotion classifier that computes the emotion levels of the user Emotions are classified according to their attractiveness (positive valence) or their averseness (negative valence) in the horizontal valence dimension. The excitement level induced by the emotions is represented by high to low positions in the vertical arousal dimension of the valence-arousal space. The signals are measured either intermittently by touching the metal electrodes on the device (for point-of-care testing) or continuously, using a chest strap for long term monitoring. The processed data from device is sent to a mobile phone using a Bluetooth Low Energy protocol. Our results show that the device can monitor the signals continuously, providing accurate detection of the motion state, for over 72 hours on a single battery charge.	[Murali, Srinivasan; Rincon, Francisco] SmartCardia, Lausanne, Switzerland; [Rincon, Francisco; Atienza, David] Ecole Polytech Fed Lausanne, ESL, Lausanne, Switzerland	Murali, S (reprint author), EPFL Innovat Pk,Batiment C, CH-1015 Lausanne, Switzerland.	srinivasan.murali@smartcardia.com					Hao Y, 2008, PHYSIOL MEAS, V29, pR27, DOI 10.1088/0967-3334/29/11/R01; Jovanov E, 2001, Biomed Sci Instrum, V37, P373; Koelstra S, 2012, IEEE T AFFECT COMPUT, V3, P18, DOI 10.1109/T-AFFC.2011.15; Kreibig SD, 2010, BIOL PSYCHOL, V84, P394, DOI 10.1016/j.biopsycho.2010.03.010; Padmanabhan M., 2015, EMBC 2015; Parkka J, 2006, IEEE T INF TECHNOL B, V10, P119, DOI 10.1109/TITB.2005.856863; Parott CW, 2004, CONGEST HEART FAI S2, V10, P11; Picard R. W., 1995, AFFECTIVE COMPUTING; Poh M.-Z., 2010, ENG MED BIOL SOC EMB; Rincon F., 2011, INFORM TECHNOLOGY BI, V15, P854; Sola J. M., 2011, THESIS; Wagner J., 2005, IEEE INT C MULT EXP, P940; Willemsen GHM, 1996, PSYCHOPHYSIOLOGY, V33, P184, DOI 10.1111/j.1469-8986.1996.tb02122.x	13	2	2	1	8	IEEE	NEW YORK	345 E 47TH ST, NEW YORK, NY 10017 USA	0276-6574		978-1-5090-0685-4	COMPUT CARDIOL			2015	42						121	124						4	Computer Science, Interdisciplinary Applications; Engineering, Multidisciplinary; Engineering, Biomedical	Computer Science; Engineering	BF1CZ	WOS:000380374700032					2019-03-21	
B	Lin, YJ; Chen, HS; Su, MJ			IEEE	Lin, Yaw-Jen; Chen, Heng-Shuen; Su, Mei-Ju			A Cloud Based Bluetooth Low Energy Tracking System for Dementia Patients	2015 EIGHTH INTERNATIONAL CONFERENCE ON MOBILE COMPUTING AND UBIQUITOUS NETWORKING (ICMU)			English	Proceedings Paper	8th International Conference on Mobile Computing and Ubiquitous Networking (ICMU)	JAN 20-22, 2015	Hakodate, JAPAN			Location Based Service; Tracker; Bluetooth Low Energy; Cloud Services		Location based services of trackers can keep dementia patients safe, but traditional GPS tracker or smartphone based solution device need to be removed for recharging or when taking bath. A water-proof Bluetooth Low Energy (BLE) tag with a CR2302 battery can be used over a year so that it can be worn all the time. By combining BLE technology, smartphones and cloud services provided by Google, we can build a practical location and tracking system with minimal cost.	[Lin, Yaw-Jen] Cent Taiwan Univ Sci & Technol, Dept Management Informat Syst, Taichung, Taiwan; [Chen, Heng-Shuen] Natl Taiwan Univ Coll Med & Hosp, Dept Family Med, Taipei, Taiwan; [Su, Mei-Ju] Yuanpei Univ, Dept Biomed Engn, Taipei, Taiwan	Su, MJ (reprint author), Yuanpei Univ, Dept Biomed Engn, Taipei, Taiwan.	yjlin1952@ctust.edu.tw; chenhs@ntu.edu.tw; merri@mail.ypu.edu.tw					Kamath Sandeep, 2012, MEASURING BLUETOOTH, P18; Lin CC, 2006, IEEE T INF TECHNOL B, V10, P696, DOI 10.1109/TITB.2006.874196; Rasquin SMC, 2007, TECHNOLOGY DISABILIT, V19, P113	3	3	3	0	0	SPRINGER-VERLAG BERLIN	BERLIN	HEIDELBERGER PLATZ 3, D-14197 BERLIN, GERMANY			978-4-907626-12-9				2015							88	89						2	Computer Science, Hardware & Architecture; Computer Science, Information Systems	Computer Science	BF1ED	WOS:000380380900025					2019-03-21	
B	Su, MJ; Chen, HS; Lin, YJ; Chen, IL; Cheng, CT			IEEE	Su, Mei-Ju; Chen, Heng-Shuen; Lin, Yaw-Jen; Chen, I-Ling; Cheng, Chih-Ting			Continuous Spine Care Service for Elderly	2015 EIGHTH INTERNATIONAL CONFERENCE ON MOBILE COMPUTING AND UBIQUITOUS NETWORKING (ICMU)			English	Proceedings Paper	8th International Conference on Mobile Computing and Ubiquitous Networking (ICMU)	JAN 20-22, 2015	Hakodate, JAPAN			Spin care service; brace; Bluetooth Low Energy	ADOLESCENT IDIOPATHIC SCOLIOSIS; BIOMECHANICS	Osteoporosis is a common bone disease in the elderly, which often causes back pain and kyphosis. In Taiwan, 51.9 percent of the elderly over 45 years old need rehabilitation and the demand of wearing orthoses aids in the aging of society has increased significantly. Physicians don't know the rehabilitation effectiveness and the patient compliance behaviors and related factors of the disease until the patients come back to the clinic. It will affect the diagnosis accuracy. In Taiwan, there isn't a continuous spin care after a patient goes to clinic. Therefore, in the study, we cooperate with orthopedics department of Mackay Memorial Hospital Hsinchu Branch to plan a continuous spin care service based on an iBrace monitor system with BLE (Blue Low Energy). iBrace integrates EMG, pressure sensors and position sensors and APP with cloud spine care service platform.	[Su, Mei-Ju] Yuanpei Univ Med Technol, Dept Biomed Engn, Hsinchu, Taiwan; [Chen, Heng-Shuen] Natl Taiwan Univ, Coll Med & Hosp, Dept Family Med, Taipei, Taiwan; [Lin, Yaw-Jen] Cent Taiwan Univ Sci & Technol, Dept Management Informat Syst, Taichung, Taiwan; [Chen, I-Ling] Mackay Med Coll, Dept Med, New Taipei, Taiwan; [Cheng, Chih-Ting] Mackay Mem Hosp, Orthoped Surg, Hsinchu, Taiwan	Cheng, CT (reprint author), Mackay Mem Hosp, Orthoped Surg, Hsinchu, Taiwan.	merri@mail.ypu.edu.tw; chenhs@ntu.edu.tw; yjlin1952@ctust.edu.tw; s8800266@hotmail.com					Goldberg CJ, 2001, SPINE, V26, P42, DOI 10.1097/00007632-200101010-00009; LONSTEIN JE, 1984, J BONE JOINT SURG AM, V66A, P1061, DOI 10.2106/00004623-198466070-00013; Lou E, 2005, MED BIOL ENG COMPUT, V43, P746, DOI 10.1007/BF02430952; Lou E, 2010, MED BIOL ENG COMPUT, V48, P235, DOI 10.1007/s11517-010-0575-4; Wong MS, 2000, PROSTHET ORTHOT INT, V24, P148, DOI 10.1080/03093640008726538	5	0	0	0	1	SPRINGER-VERLAG BERLIN	BERLIN	HEIDELBERGER PLATZ 3, D-14197 BERLIN, GERMANY			978-4-907626-12-9				2015							90	91						2	Computer Science, Hardware & Architecture; Computer Science, Information Systems	Computer Science	BF1ED	WOS:000380380900026					2019-03-21	
B	Bisio, I; Sciarrone, A; Zappatore, S			IEEE	Bisio, Igor; Sciarrone, Andrea; Zappatore, Sandro			Asset Tracking Architecture with Bluetooth Low Energy Tags and ad hoc Smartphone Applications	2015 EUROPEAN CONFERENCE ON NETWORKS AND COMMUNICATIONS (EUCNC)			English	Proceedings Paper	European Conference On Networks And Communications (EuCNC)	JUN 29-JUL 02, 2015	Paris, FRANCE					The paper describes an original architecture aimed at tracking assets within construction sites or similar contexts. The main components are: i) RFID tags, ii) Bluetooth Low Energy (BLE) tags and iii) smartphones. The core functions of the architecture are performed by two Android applications: the Asset Proximity Locator (APL) and the Wandering Objects Location Finder (WOLF). The key feature of the asset tracking function is the ability to maximize smartphone battery lifetime by switching on and off the GPS unit, thus guaranteeing that the smartphone can be used for an entire working shift. A detailed energy consumption analysis is carried out for each component of the architecture. The results achieved by simulations, concerning BLE tag detection probability, are presented and discussed.								Balakrishnan D, 2012, IEEE T PARALL DISTR, V23, P211, DOI 10.1109/TPDS.2011.128; Berruti L., 2007, SIGNALS COMMUNICATIO, P295; Bisio I, 2013, IEEE T MULTIMEDIA, V15, P858, DOI 10.1109/TMM.2013.2239631; Carroll A., 2010, USENIXATC 10, P21; Kelepouris T, 2010, INT J PROD ECON, V126, P324, DOI 10.1016/j.ijpe.2010.04.009; Linqing G., 2011, NETWORK PROTOCOLS AL, V3; Lloret J, 2009, SENSORS-BASEL, V9, P3695, DOI 10.3390/s90503695; Mittal R, 2012, MOBICOM 12: PROCEEDINGS OF THE 18TH ANNUAL INTERNATIONAL CONFERENCE ON MOBILE COMPUTING AND NETWORKING, P317; Pathak A, 2011, EUROSYS 11: PROCEEDINGS OF THE EUROSYS 2011 CONFERENCE, P153; Perrucci G. P., 2011, VEH TECHN C VTC SPRI, P1, DOI DOI 10.1109/VETECS.2011.5956528; Shangguan L., 2013, IEEE T PARALL DISTR, V99, P1, DOI DOI 10.1109/TPDS.2013.236; Zhangy Lide, 2010, CODES ISSS 10, P105, DOI DOI 10.1145/1878961.1878982	12	1	1	0	4	IEEE	NEW YORK	345 E 47TH ST, NEW YORK, NY 10017 USA			978-1-4673-7359-3				2015							460	464						5	Computer Science, Hardware & Architecture; Engineering, Electrical & Electronic; Telecommunications	Computer Science; Engineering; Telecommunications	BF1IG	WOS:000380399400090					2019-03-21	
B	Chen, N; Li, XD; Deters, R			IEEE	Chen, Nan; Li, Xiaodan; Deters, Ralph			Collaboration & Mobile Cloud-Computing Using CoAP to enable resource-sharing between clouds of mobile devices	2015 IEEE CONFERENCE ON COLLABORATION AND INTERNET COMPUTING (CIC)			English	Proceedings Paper	IEEE Conference Collaboration Internet Computing	OCT 28-30, 2015	Hangzhou, PEOPLES R CHINA	IEEE, IEEE Comp Soc, Zhejiang Univ, ADTIME		CoAP; Mobile Cloud-Computing; Device Cloud; Bluetooth Low Energy		As the number of mobile devices per user increases, the need to connect/combine them grows. Current approaches focus on the use of cloud-hosted backend services which allow file and app-state synchronization but fail in providing true resource sharing among mobile devices. To enable true resource/service sharing, the mobile devices of a single user should be combined into a cloud of cooperating mobile devices. Instead of accessing the resources/services of an individual device, a user should be able to seamlessly access the combined resources/services of his/her device cloud. Enabling seamless access to the resources/services hosted on different mobile devices is therefore a key challenge. Exposing the resources/services of each mobile devices within the user's device cloud via RESTful micro-services, is one possible approach. This paper focusses on the use of the IoT protocol CoAP as an application layer protocol. To minimize the energy costs of communication, it was necessary to replace CoAP's standard transport protocol (UDP) with BLE 4.1. This paper presents the performance of the CoAP protocol using BLE 4.1 on Android Lollipop.	[Chen, Nan; Li, Xiaodan; Deters, Ralph] Univ Saskatchewan, Dept Comp Sci, Saskatoon, SK, Canada	Chen, N (reprint author), Univ Saskatchewan, Dept Comp Sci, Saskatoon, SK, Canada.	nac856@usask.ca; xil623@usask.ca; deters@cs.usask.ca		Deters, Ralph/0000-0001-6703-5839			Beccue M., 2009, MOBILE CLOUD COMPUTI; Chatarji J, INTRO SERVICE ORIENT; Chu D. C., 2004, GRID COMP 2004 P 5 I, P182; Chun B.-G., 2011, P 6 C COMP SYST, P301, DOI DOI 10.1145/1966445.1966473; Cuervo E., 2010, P 8 INT C MOB SYST A, P49, DOI DOI 10.1145/1814433.1814441; Dementyev A, 2013, WIR S IWS 2013 IEEE; Dou  A., 2010, P 3 INT C PERV TECHN; Ferronato P., 2007, ARCHITECTURE DIGITAL; Fielding R. T., 2000, THESIS; Kotilainen N, 2005, Third IEEE International Conference on Pervasive Computing and Communications, Workshops, P86, DOI 10.1109/PERCOMW.2005.58; Marinelli E.E., 2009, HYRAX CLOUD COMPUTIN; Namiot D., 2014, INT J OPEN INFORM TE, V2, P24; SATYANARAYANAN M, 2005, PERVASIVE MOB COMPUT, V1, P157, DOI DOI 10.1016/J.PMCJ.2005.03.005; SATYANARAYANAN M, 2009, PERVASIVE COMPUTING, V8, P14, DOI DOI 10.1109/MPRV.2009.82; Schulte Roy W., 1996, NATIS SERVICE ORIENT; Shelby Zach, 2014, CONSTRAINED APPL PRO; Smaldone S., 2009, MOBISYS 09; Uden L., 2007, ACTIVITY THEORY OSS; Xue S., 2015, 6 INT C EM UB SYST P	19	1	1	0	0	IEEE	NEW YORK	345 E 47TH ST, NEW YORK, NY 10017 USA			978-1-5090-0089-0				2015							119	124		10.1109/CIC.2015.39				6	Computer Science, Theory & Methods	Computer Science	BF1HK	WOS:000380397300015					2019-03-21	
B	Garcia-Espinosa, E; Veloz-Guerrero, A; Longoria-Gandara, O; Riva, GG			IEEE	Garcia-Espinosa, E.; Veloz-Guerrero, A.; Longoria-Gandara, O.; Riva, G. G.			Hearing Aid devices for Smart Cities: A Survey	2015 IEEE FIRST INTERNATIONAL SMART CITIES CONFERENCE (ISC2)			English	Proceedings Paper	IEEE First International Smart Cities Conference (ISC2)	OCT 25-28, 2015	Guadalajara, MEXICO			Hearing aid; bluetooth low energy; smart cities		Hearing loss population has increased in recent years. Hearing aid technology has evolved in the last decade but the percentage of users of such devices remains very low. With the advent of wireless communication protocols such as Bluetooth Low Energy (BLE), along with the exponential growth of smart phone demand, it is expected an increment of the users of hearing aid devices due to the new use cases that BLE will create. In this contribution, we provide a survey of the existing technologies for hearing aid and their use cases. Because one of the key objectives of smart cities is the quality of life of their citizens, we explain how several hearing aid use cases can be applied in these scenarios.	[Garcia-Espinosa, E.] Intel Corp, ITESO, Elect Syst & IT Dept, Guadalajara, Mexico; [Veloz-Guerrero, A.] Intel Corp, Intel Labs, Guadalajara, Mexico; [Longoria-Gandara, O.] ITESO, Elect Syst & IT Dept, Guadalajara, Mexico; [Riva, G. G.] Natl Univ Cordoba UNC, Natl Univ Technol UTN, Cordoba, Argentina	Garcia-Espinosa, E (reprint author), Intel Corp, ITESO, Elect Syst & IT Dept, Guadalajara, Mexico.	eduardo.garcia@intel.com; a.veloz@intel.com; olongoria@iteso.mx; guillermo.riva@efn.uncor.edu					BETLEHEM T, 2015, SIGNAL PROCESSING MA, V32, P81, DOI DOI 10.1109/MSP.2014.2360707; Bluetooth SIG, 2013, SPEC BLUET SYST COV; Duthey B., 2013, 621 WHO; Edwards Brent, 2007, Trends Amplif, V11, P31, DOI 10.1177/1084713806298004; Galen Carol Audio, 2007, DEC LOUDN COMP CHART; Hamacher V, 2005, EURASIP J APPL SIG P, V2005, P2915, DOI 10.1155/ASP.2005.2915; Kelly B, 2014, PROCEDIA COMPUT SCI, V32, P661, DOI 10.1016/j.procs.2014.05.474; Kochkin S., 2009, HEAR REV, V62, P12; KOWALCZYK K, 2015, SIGNAL PROCESSING MA, V32, P31, DOI DOI 10.1109/MSP.2014.2369531; Marshall B., 2005, HEAR J, V58, P60; McCormack A, 2013, INT J AUDIOL, V52, P360, DOI 10.3109/14992027.2013.769066; Pellicer Soledad, 2013, INN MOB INT SERV UB; Pharr C., 2013, IEEE INT C INT THINS; World Health Organization, 2015, DEAFN HEAR LOSS	14	0	0	0	0	IEEE	NEW YORK	345 E 47TH ST, NEW YORK, NY 10017 USA			978-1-4673-6552-9				2015														5	GREEN & SUSTAINABLE SCIENCE & TECHNOLOGY; Engineering, Multidisciplinary	Science & Technology - Other Topics; Engineering	BF2JF	WOS:000380472400053					2019-03-21	
S	Hale, ML; Ellis, D; Gamble, R; Walter, C; Lin, J		Altintas, O; Zhang, J		Hale, Matthew L.; Ellis, Dalton; Gamble, Rose; Walter, Charles; Lin, Jessica			SecuWear: An open source, multi-component hardware/software platform for exploring wearable security	2015 IEEE THIRD INTERNATIONAL CONFERENCE ON MOBILE SERVICES MS 2015	IEEE International Conference on Mobile Services		English	Proceedings Paper	IEEE Third International Conference on Mobile Services MS	JUN 27-JUL 02, 2015	New York, NY	Conf publishing Services, IEEE Comp Soc		wearables; security; vulnerability discovery; internet of things; Bluetooth low energy; man-in-the-middle		Wearables are the next big development in the mobile internet of things. Operating in a body area network around a smartphone user they serve a variety of commercial, medical, and personal uses. Whether used for fitness tracking, mobile health monitoring, or as remote controllers, wearable devices can include sensors that collect a variety of data and actuators that provide haptic feedback and unique user interfaces for controlling software and hardware. Wearables are typically wireless and use Bluetooth LE (low energy) to transmit data to a waiting smartphone app. Frequently, apps forward this data onward to online web servers for tracking. Security and privacy concerns abound when wearables capture sensitive data or provide critical functionality. This paper develops a platform, called SecuWear, for conducting wearable security research, collecting data, and identifying vulnerabilities in hardware and software. SecuWear combines open source technologies to enable researchers to rapidly prototype security vulnerability test cases, evaluate them on actual hardware, and analyze the results to understand how best to mitigate problems. The paper includes two types of evaluation in the form of a comparative analysis and empirical study. The results reveal how several passive observation attacks present themselves in wearable applications and how the SecuWear platform can capture the necessary information needed to identify and combat such attacks.	[Hale, Matthew L.; Ellis, Dalton] Univ Nebraska, Sch Interdisciplinary Informat, Omaha, NE 68182 USA; [Gamble, Rose; Walter, Charles; Lin, Jessica] Univ Tulsa, Tandy Sch Comp Sci, Tulsa, OK 74104 USA	Hale, ML (reprint author), Univ Nebraska, Sch Interdisciplinary Informat, Omaha, NE 68182 USA.	mlhale@unomaha.edu; gamble@utulsa.edu					[Anonymous], 2014, NAT VULN DAT; [Anonymous], 2014, GOOGLE GLASS TECHNIC; [Anonymous], 2013, BLUET COR SPEC VERS; [Anonymous], 2014, FITBIT CHARGEHR SPEC; [Anonymous], 2014, SENSORDRONE API; [Anonymous], 2014, WEAR COMP GLOB MARK; [Anonymous], 2014, NIKE SPORTBAND SPECI; [Anonymous], 2014, PEBBLE SMART WATCH S; [Anonymous], 2015, CORDOVA PULGINS; [Anonymous], 2015, DJANGO REST FRAMEWOR; [Anonymous], 2014, SAMSUNG GEAR FIT WAT; Apache Software Foundation, 2013, AB AP CORD; BluetoothSIG, 2014, BLUET LE APPR SERV S; Callaghan M., 2006, IJCSNS INT J COMPUTE, V6, P125; Chun W. J, 2008, PYTHON WEB DEV DJANG; Coleman D., BLUETOOTH LOW ENERGY; Cranor L., 2014, SECURITY PRIVACY IEE, V12, P55; Cyr B, 2014, SECURITY ANAL WEARAB; Dowd M., 2006, PEARSON ED; Enck W., 2014, ACM T COMPUTER SYSTE, V32; Gates CS, 2014, IEEE T DEPEND SECURE, V11, P252, DOI 10.1109/TDSC.2013.58; Gomez C, 2012, SENSORS-BASEL, V12, P11734, DOI 10.3390/s120911734; Hunt R., 2013, NETW ICON 2013 19 IE, P1; Hurlburt G, 2011, IT PROF, V13, P9, DOI 10.1109/MITP.2011.104; Jain AK, 2012, IT PROF, V14, P28, DOI 10.1109/MITP.2012.72; MbientLab,, METAWEAR PROD SPC V0; MbientLab, MEAWEAT API DOC; MetaGeek, 2015, WI SPY 2 4 GHZ SPECT; Mikkonen T., 2011, P 2 WORKSH SOFTW ENG; MITRE, 2014, COMM WEAKN EN CWE; MITRE, 2014, COMM VULN EXP; Ossmann M., 2012, PROJECT UBERTOOTH, V18, P23; Patel M, 2010, IEEE WIREL COMMUN, V17, P80, DOI 10.1109/MWC.2010.5416354; Picco G., 2014, P FUT SOFTW ENG, P13, DOI DOI 10.1145/2593882.2593884; Ryan M., 2013, P 7 USENIX C OFF TEC; Stern B., 2015, GETTING STARTED FLOR; Takahashi D., 2011, INSULIN PUMP HACKER; Wargo J., 2013, APACHE CORDOVA 3 PRO; Yilmaz T, 2010, SENSORS-BASEL, V10, P10837, DOI 10.3390/s101210837	39	5	5	2	5	IEEE	NEW YORK	345 E 47TH ST, NEW YORK, NY 10017 USA	2329-6429		978-1-4673-7284-8	IEEE INT CONF MO			2015							97	104		10.1109/MS.2015.23				8	Computer Science, Hardware & Architecture; Engineering, Electrical & Electronic; Telecommunications	Computer Science; Engineering; Telecommunications	BF1JH	WOS:000380402000013					2019-03-21	
